name, link, rating, votes, year, releaseDate, genres, runtime, plot, image, imageCaption, metascore, certificate, status

"Project Hail Mary", "https://www.imdb.com/title/tt12042730/", "8.4", "196874", "2026", "20/3/2026", "Adventure, Comedy, Sci-Fi", "9360", "A science teacher wakes up alone on a spaceship. As his memory returns, he uncovers a mission to stop a mysterious substance killing Earth's sun and that an unexpected friendship may be the key.", "https://m.media-amazon.com/images/M/MV5BNTkwNzJiYTctNzI3NC00NjE1LTlhYjktY2Q5MTdmMWFmNzcxXkEyXkFqcGc@._V1_.jpg", "Ryan Gosling and James Ortiz in Project Hail Mary (2026)", "77", "PG-13", "Released"
"Thrash", "https://www.imdb.com/title/tt32362890/", "5.1", "10245", "2026", "10/4/2026", "Horror, Thriller", "5160", "When a Category 5 hurricane decimates a coastal town, the storm surge brings devastation, chaos and something far more frightening: hungry sharks.", "https://m.media-amazon.com/images/M/MV5BODMxNjdhMWQtMmJhYS00MDc1LTkyYzAtYTgzZTFhMmI1ODEyXkEyXkFqcGc@._V1_.jpg", "Phoebe Dynevor in Thrash (2026)", "47", "R", "Released"
"The Super Mario Galaxy Movie", "https://www.imdb.com/title/tt28650488/", "6.5", "30840", "2026", "1/4/2026", "Animation, Adventure, Comedy", "5880", "Mario ventures into space, exploring cosmic worlds and tackling galactic challenges far from the familiar Mushroom Kingdom.", "https://m.media-amazon.com/images/M/MV5BMDg5MjRkNWEtYmU1Mi00MTExLTk5MDQtY2RiMWVkZWNiOThjXkEyXkFqcGc@._V1_.jpg", "Jack Black, Charlie Day, Luis Guzmán, Brie Larson, Chris Pratt, Keegan-Michael Key, Benny Safdie, Virginia Dare Jelenic, Donald Glover, and Anya Taylor-Joy in The Super Mario Galaxy Movie (2026)", "37", "PG", "Released"
"The Drama", "https://www.imdb.com/title/tt33071426/", "7.5", "23142", "2026", "3/4/2026", "Comedy, Drama, Romance", "6300", "A happily engaged couple is put to the test when an unexpected turn sends their wedding week off the rails.", "https://m.media-amazon.com/images/M/MV5BMTcwOGZhYmItYTg3ZS00NjUwLWJiMmQtMjU5YjEwYWY0NmNkXkEyXkFqcGc@._V1_.jpg", "Robert Pattinson and Zendaya in The Drama (2026)", "59", "R", "Released"
"Crime 101", "https://www.imdb.com/title/tt32430579/", "6.8", "53501", "2026", "13/2/2026", "Crime, Drama, Thriller", "8400", "An elusive thief, eyeing his final score, encounters a disillusioned insurance broker at her own crossroads. As their paths intertwine, a relentless detective trails them hoping to thwart the multi-million dollar heist they are planning.", "https://m.media-amazon.com/images/M/MV5BZThlN2M4ZTUtYTU3Mi00MDE5LWFhYWUtNjkxMWEwNjUwNDVhXkEyXkFqcGc@._V1_.jpg", "Halle Berry, Mark Ruffalo, Chris Hemsworth, and Barry Keoghan in Crime 101 (2026)", "68", "R", "Released"
"Outcome", "https://www.imdb.com/title/tt23724682/", "4.6", "3562", "2026", "10/4/2026", "Comedy, Crime, Drama", "4980", "Follows Hollywood star Reef as he is forced to confront his problems and atone for his past after being threatened by a bizarre video footage from his past.", "https://m.media-amazon.com/images/M/MV5BMzFmMWExMmMtZmYwZi00ZDIyLTlhYTUtZmM3ZTBlZWNjOWY4XkEyXkFqcGc@._V1_.jpg", "Keanu Reeves in Outcome (2026)", "37", "R", "Released"
"Dhurandhar The Revenge", "https://www.imdb.com/title/tt39139925/", "8.5", "44881", "2026", "19/3/2026", "Action, Crime, Thriller", "13800", "Jaskirat Singh Rangi descends deeper into his alias as Hamza Ali Mazari, rising through Karachi's criminal hierarchy to claim the feared title "Sher-e-Baloch" while balancing loyalty, betrayal, and survival in a ruthless underworld.", "https://m.media-amazon.com/images/M/MV5BNzdkNjAxNWMtNWY3My00NTI1LTg2YWQtOGI3MDA0NzdhMjEyXkEyXkFqcGc@._V1_.jpg", "Dhurandhar The Revenge (2026)", "", "", "Released"
"Send Help", "https://www.imdb.com/title/tt8036976/", "6.9", "69890", "2026", "30/1/2026", "Adventure, Horror, Thriller", "6780", "When an employee and her insufferable boss become stranded on a deserted island, the only survivors of a plane crash, they must overcome past grievances and work together to make it out alive.", "https://m.media-amazon.com/images/M/MV5BOTgxOWY5NTMtYjdiNi00NTIyLTkwMTQtMWNjM2IzYTU0ODgyXkEyXkFqcGc@._V1_.jpg", "Rachel McAdams and Dylan O'Brien in Send Help (2026)", "75", "R", "Released"
"Michael", "https://www.imdb.com/title/tt11378946/", "0", "0", "2026", "24/4/2026", "Biography, Drama, History", "7620", "The story of the famous musician Michael Jackson, known as the King of Pop.", "https://m.media-amazon.com/images/M/MV5BNzllNmRlN2EtMDQyOC00ODJjLTg4OWQtZDNmNGU3YzlkNjc1XkEyXkFqcGc@._V1_.jpg", "Jaafar Jackson in Michael (2026)", "", "PG-13", "Released"
"Pizza Movie", "https://www.imdb.com/title/tt37209937/", "5.8", "5228", "2026", "3/4/2026", "Comedy", "5820", "High college students face an unexpectedly epic journey when they must navigate two flights of stairs to retrieve their pizza delivery, turning a simple task into a surreal adventure.", "https://m.media-amazon.com/images/M/MV5BODQxYzE1NDQtOGQ2Zi00YWQ2LTgwMTktODM5YTk4ODI5MTYzXkEyXkFqcGc@._V1_.jpg", "Jack Martin, Caleb Hearon, Marcus Scribner, Sean Giambrone, Lulu Wilson, Gaten Matarazzo, Peyton Elizabeth Lee, and Sarah Sherman in Pizza Movie (2026)", "64", "TV-MA", "Released"
"Ready or Not 2: Here I Come", "https://www.imdb.com/title/tt33978029/", "6.8", "15057", "2026", "20/3/2026", "Comedy, Horror, Thriller", "6480", "After surviving one deadly game, Grace and her sister Faith must now outrun four rival families competing for a powerful throne - winner takes all.", "https://m.media-amazon.com/images/M/MV5BZTM3N2EyMTEtNDhkMi00ZjNiLWI0MWUtOGViMjExODY3YTJhXkEyXkFqcGc@._V1_.jpg", "David Cronenberg, Elijah Wood, Sarah Michelle Gellar, Nestor Carbonell, Shawn Hatosy, Kevin Durand, Kathryn Newton, Dan Beirne, Maia Jae, Juan Pablo Romero, Olivia Cheng, Samara Weaving, Varun Saranga, Nadeem Umar-Khitab, Masa Lizdek, and Antony Hall in Ready or Not 2: Here I Come (2026)", "58", "R", "Released"
"Lee Cronin's the Mummy", "https://www.imdb.com/title/tt32612507/", "0", "0", "2026", "17/4/2026", "Horror", "7980", "The young daughter of a journalist disappears into the desert without a trace. Eight years later, the broken family is shocked when she is returned to them, as what should be a joyful reunion turns into a living nightmare.", "https://m.media-amazon.com/images/M/MV5BNWQ1NzI2YTUtN2E0ZS00YzVmLTkxNjktMWIzNTYwMzkyOTU0XkEyXkFqcGc@._V1_.jpg", "Lee Cronin's the Mummy (2026)", "", "R", "Completed"
"Mike & Nick & Nick & Alice", "https://www.imdb.com/title/tt27552099/", "6.2", "13549", "2026", "27/3/2026", "Action, Comedy, Crime", "6420", "Two friends navigate the dangerous world of organized crime, testing their loyalty and survival skills as they get deeper into the criminal underworld.", "https://m.media-amazon.com/images/M/MV5BZDBiNjIyNjUtNWZlYy00MGU4LWFjNDUtMGExYTZlNmNhZTY4XkEyXkFqcGc@._V1_.jpg", "Vince Vaughn, James Marsden, and Eiza González in Mike & Nick & Nick & Alice (2026)", "70", "R", "Released"
"Mercy", "https://www.imdb.com/title/tt31050594/", "6.2", "54829", "2026", "23/1/2026", "Action, Crime, Drama", "5940", "Set in the near future, a detective accused of murdering his wife has 90 minutes to prove his innocence to an advanced AI judge.", "https://m.media-amazon.com/images/M/MV5BMWJmYjcwMTMtMDU1ZC00ZGI5LTlmZDAtODI3NDA2ZTE5ZGVlXkEyXkFqcGc@._V1_.jpg", "Rebecca Ferguson and Chris Pratt in Mercy (2026)", "34", "PG-13", "Released"
"The Bride!", "https://www.imdb.com/title/tt30851137/", "5.7", "19285", "2026", "6/3/2026", "Drama, Horror, Romance", "7560", "In 1930s Chicago, Frankenstein asks Dr. Euphronius to help create a companion. They give life to a murdered woman as the Bride, sparking romance, police interest, and radical social change.", "https://m.media-amazon.com/images/M/MV5BM2VmMDVlNzgtNThhZC00ZGMwLTg4MmEtZTUzNmRiYTkxYzUyXkEyXkFqcGc@._V1_.jpg", "Christian Bale and Jessie Buckley in The Bride! (2026)", "55", "R", "Released"
"Peaky Blinders: The Immortal Man", "https://www.imdb.com/title/tt15574124/", "6.6", "66253", "2026", "20/3/2026", "Crime, Drama, History", "6720", "During World War II, Tommy Shelby returns to a bombed Birmingham and becomes involved in secret wartime missions facing new threats as he reckons with his past.", "https://m.media-amazon.com/images/M/MV5BNTdlNTNjNjctYTg2MC00NTFlLTliNTctODFiZjZmNWRkYTVlXkEyXkFqcGc@._V1_.jpg", "Cillian Murphy in Peaky Blinders: The Immortal Man (2026)", "59", "R", "Released"
"Tu Yaa Main", "https://www.imdb.com/title/tt36118360/", "7.1", "4083", "2026", "13/2/2026", "Romance, Thriller", "8580", "Two content creators' adventure becomes a deadly game of survival, forcing them to navigate both nature's dangers and their own rivalry.", "https://m.media-amazon.com/images/M/MV5BOGIzNWVkODctYWNmZS00MGU2LWI3ZGItY2Q0YTAyYzEzMDA5XkEyXkFqcGc@._V1_.jpg", "Shanaya Kapoor and Adarsh Gourav in Tu Yaa Main (2026)", "", "", "Released"
"Wuthering Heights", "https://www.imdb.com/title/tt32897959/", "6.2", "56456", "2026", "13/2/2026", "Drama, Romance", "8160", "A passionate and tumultuous love story set against the backdrop of the Yorkshire moors, exploring the intense and destructive relationship between Heathcliff and Catherine Earnshaw.", "https://m.media-amazon.com/images/M/MV5BMGFlMTVkMDktZGMzMC00Yjk4LWFmNzEtNTFmMzM2YzM3MWFkXkEyXkFqcGc@._V1_.jpg", "Margot Robbie and Jacob Elordi in Wuthering Heights (2026)", "55", "R", "Released"
"Hoppers", "https://www.imdb.com/title/tt26443616/", "7.5", "32747", "2026", "6/3/2026", "Animation, Adventure, Comedy", "6240", "A 19-year-old animal lover uses technology that places her consciousness into a robotic beaver to uncover mysteries within the animal world beyond her imagination.", "https://m.media-amazon.com/images/M/MV5BNzRiMzZlMTMtNmU3OC00MDUwLThmNDUtMTBjZmQ3MWQ4NTljXkEyXkFqcGc@._V1_.jpg", "Melissa Villaseñor and Piper Curda in Hoppers (2026)", "73", "PG", "Released"
"War Machine", "https://www.imdb.com/title/tt15940132/", "6.3", "85323", "2026", "6/3/2026", "Action, Sci-Fi, Thriller", "6360", "Follow the final recruits of a grueling special ops boot camp who encounter a mysterious deadly force.", "https://m.media-amazon.com/images/M/MV5BMmM1ZTc5ZTYtOTM2My00MjBmLWE5NzktYzkyYzdlYWE3ZDAzXkEyXkFqcGc@._V1_.jpg", "Alan Ritchson in War Machine (2026)", "54", "R", "Released"
"28 Years Later: The Bone Temple", "https://www.imdb.com/title/tt32141377/", "7.3", "83103", "2026", "16/1/2026", "Horror, Sci-Fi, Thriller", "6540", "As Spike is inducted into Jimmy Crystal's gang on the mainland, Dr. Kelson makes a discovery that could alter the world.", "https://m.media-amazon.com/images/M/MV5BZGU2M2Y1YTItMWYxNS00NDYxLThhOTYtNjNhOWUzNjA3MTYwXkEyXkFqcGc@._V1_.jpg", "Ralph Fiennes, Alfie Williams, Jack O'Connell, Chi Lewis-Parry, and Erin Kellyman in 28 Years Later: The Bone Temple (2026)", "81", "R", "Released"
"Faces of Death", "https://www.imdb.com/title/tt14619456/", "6.5", "848", "2026", "10/4/2026", "Horror", "5820", "A woman, employed as a website content moderator, comes across a series of violent videos reproducing death scenes from a film.", "https://m.media-amazon.com/images/M/MV5BMGJlZjY2ZGMtYjY0Ny00MTFmLTg0YTItM2MzYTQ4ZGNjMzkxXkEyXkFqcGc@._V1_.jpg", "Dacre Montgomery and Barbie Ferreira in Faces of Death (2026)", "63", "R", "Released"
"The Invite", "https://www.imdb.com/title/tt14173636/", "5.8", "256", "2026", "3/7/2026", "Comedy, Drama", "6420", "Joe and Angela's marriage is on thin ice. When they invite their enigmatic upstairs neighbors for a dinner party, the night spirals into unexpected places.", "https://m.media-amazon.com/images/M/MV5BN2ZjZWI0YTctOGJmNC00MWJlLTk4MTAtM2RlZjgxYmY4ZmE5XkEyXkFqcGc@._V1_.jpg", "The Invite (2026)", "77", "R", "Released"
"You, Me & Tuscany", "https://www.imdb.com/title/tt36352591/", "6.5", "949", "2026", "10/4/2026", "Comedy, Romance", "6240", "When a woman crashes at an empty Italian villa, posing as the owner's fiancée, she discovers an unexpected romance that could transform her life.", "https://m.media-amazon.com/images/M/MV5BZjg0MjliNDctMDE3NS00ZmMzLWE1ODUtZDcyN2I3NDE2YmUxXkEyXkFqcGc@._V1_.jpg", "Halle Bailey and Regé-Jean Page in You, Me & Tuscany (2026)", "53", "PG-13", "Released"
"GOAT", "https://www.imdb.com/title/tt27613895/", "6.7", "14630", "2026", "13/2/2026", "Animation, Action, Adventure", "6000", "A small goat with big dreams gets a once-in-a-lifetime shot to join the pros and play roarball, a high-intensity, co-ed, full-contact sport dominated by the fastest, fiercest animals in the world.", "https://m.media-amazon.com/images/M/MV5BYzE5OTJkOGMtYWFiNi00NTlkLWE3ZWItY2ZlNjkyOWVhMjMyXkEyXkFqcGc@._V1_.jpg", "Wayne Knight, Gabrielle Union, David Harbour, Rayaan Kamal Khan, Savannah Van Van McConneaughey, Nick Kroll, Angelo Kouyate, Cassius Peyton, Kingston Peyton, Nicola Coughlan, Stephen Curry, Caleb McLaughlin, and Aaron Pierre in GOAT (2026)", "60", "PG", "Released"
"How to Make a Killing", "https://www.imdb.com/title/tt4357198/", "6.5", "17251", "2026", "20/2/2026", "Comedy, Drama, Thriller", "6300", "Disowned at birth by his obscenely wealthy family, a blue-collar will stop at nothing to reclaim his inheritance, no matter how many relatives stand in his way.", "https://m.media-amazon.com/images/M/MV5BOTkwY2JjMWYtOGU4YS00ZTg0LWIzYzUtZDkxNDE5NWNkNWM1XkEyXkFqcGc@._V1_.jpg", "Glen Powell in How to Make a Killing (2026)", "49", "R", "Released"
"Scream 7", "https://www.imdb.com/title/tt27047903/", "5.5", "45495", "2026", "27/2/2026", "Horror, Mystery", "6840", "When a new Ghostface killer emerges in the town where Sidney Prescott has built a new life, her darkest fears are realized as her daughter becomes the next target.", "https://m.media-amazon.com/images/M/MV5BMzk2YzRjYmItNTA5Mi00ODczLTljYzUtOWE1ZDFkODhlZWJlXkEyXkFqcGc@._V1_.jpg", "Neve Campbell, Courteney Cox, Mark Consuelos, Ethan Embry, Joel McHale, Asa Germann, Sam Rechner, Anna Camp, Mason Gooding, Timothy Simons, Mckenna Grace, Jasmin Savoy Brown, Isabel May, and Celeste O'Connor in Scream 7 (2026)", "35", "R", "Released"
"Backrooms", "https://www.imdb.com/title/tt26657236/", "0", "0", "2026", "29/5/2026", "Horror, Sci-Fi", "6300", "After a therapist's patient goes missing into a dimension beyond reality, she has to enter the unknown to save him.", "https://m.media-amazon.com/images/M/MV5BYzQyYjZmMjctMzIyZi00MDI0LWJhNGQtMzQ3MTFlNDgwNGM5XkEyXkFqcGc@._V1_.jpg", "Renate Reinsve in Backrooms (2026)", "", "", "Completed"
"Pretty Lethal", "https://www.imdb.com/title/tt26678938/", "5.8", "9467", "2026", "25/3/2026", "Action, Horror, Thriller", "5280", "It follows a group of ballerinas as they try to escape from a remote inn after their bus breaks down on the way to a dance competition.", "https://m.media-amazon.com/images/M/MV5BMTRmMTE4MmYtOWRmNi00ZDJjLWFmY2UtNTliMzlkNTUzNDRjXkEyXkFqcGc@._V1_.jpg", "Uma Thurman, Iris Apatow, Maddie Ziegler, Lana Condor, Avantika, and Millicent Simmonds in Pretty Lethal (2026)", "51", "R", "Released"
"They Will Kill You", "https://www.imdb.com/title/tt31728330/", "6.5", "7793", "2026", "27/3/2026", "Action, Comedy, Horror", "5640", "A woman takes a job as a housekeeper in a NYC high-rise, unaware of the building's history of disappearances. She soon realizes the community is shrouded in mystery.", "https://m.media-amazon.com/images/M/MV5BYjg5ZjQ0ZGQtMmY1NS00NTgyLTlkZWYtMDhlNzE3ZGY5ZDdmXkEyXkFqcGc@._V1_.jpg", "Patricia Arquette, Heather Graham, Tom Felton, Paterson Joseph, Zazie Beetz, and Myha'la in They Will Kill You (2026)", "50", "R", "Released"
"The Yeti", "https://www.imdb.com/title/tt14500286/", "3.9", "410", "2026", "10/4/2026", "Horror", "5580", "Merriell Sunday Sr. and Hollis Bannister vanished in Alaska. Ellie and Merriell Jr. mount a search, but an ancient threat stalks their expedition into the wilderness, hunting them as they seek the truth behind the disappearances.", "https://m.media-amazon.com/images/M/MV5BNDA4OGU1ZjQtNDI3ZS00NGE5LThjOWQtODQ1ZWRkNTY2NDcxXkEyXkFqcGc@._V1_.jpg", "The Yeti (2026)", "", "R", "Released"
"Masters of the Universe", "https://www.imdb.com/title/tt0427340/", "0", "0", "2026", "5/6/2026", "Action, Adventure, Family", "", "A young man on Earth discovers a fabulous secret legacy as the prince of an alien planet, and must recover a magic sword and return home to protect his kingdom.", "https://m.media-amazon.com/images/M/MV5BN2MzMjMyNmQtYzkwMC00NTM2LThmN2ItMTczMGVmNGY5ODZlXkEyXkFqcGc@._V1_.jpg", "Jared Leto and Nicholas Galitzine in Masters of the Universe (2026)", "", "", "Post-production"
"The Devil Wears Prada 2", "https://www.imdb.com/title/tt33612209/", "0", "0", "2026", "1/5/2026", "Comedy, Drama", "7200", "As Miranda Priestly nears retirement, she reunites with Andy Sachs to face off against her former assistant turned rival: Emily Charlton.", "https://m.media-amazon.com/images/M/MV5BZmM3ZDU3ODItZmY5Yi00OTQ2LWE5OTctZTA5NDBhMWJkOGY3XkEyXkFqcGc@._V1_.jpg", "Meryl Streep, Stanley Tucci, Anne Hathaway, and Emily Blunt in The Devil Wears Prada 2 (2026)", "", "PG-13", "Completed"
"The Odyssey", "https://www.imdb.com/title/tt33764258/", "0", "0", "2026", "17/7/2026", "Action, Adventure, Fantasy", "", "After the Trojan War, Odysseus faces a dangerous voyage back to Ithaca, meeting creatures like the Cyclops Polyphemus, Sirens, and Circe along the way.", "https://m.media-amazon.com/images/M/MV5BN2MyYjk2MWMtODMyZS00MDUyLWE0OGQtOTQ3MGY0MDE0ZjVmXkEyXkFqcGc@._V1_.jpg", "The Odyssey (2026)", "", "", "Completed"
"Shelter", "https://www.imdb.com/title/tt32357218/", "6.1", "24939", "2026", "30/1/2026", "Action, Thriller", "6420", "Michael Mason is a recluse on a remote Scottish island who rescues a girl from the sea, unleashing a perilous sequence of events that culminate in an attack on his home, compelling him to face his turbulent history.", "https://m.media-amazon.com/images/M/MV5BMzI2ODY3MzQtYzllNy00YWM1LWExZTgtOGIwNjk2MmE2MmY2XkEyXkFqcGc@._V1_.jpg", "Jason Statham and Bodhi Rae Breathnach in Shelter (2026)", "50", "R", "Released"
"The Rip", "https://www.imdb.com/title/tt32642706/", "6.8", "122269", "2026", "16/1/2026", "Action, Crime, Drama", "6780", "A group of Miami cops discovers a stash of millions in cash, leading to distrust as outsiders learn about the huge seizure, making them question who to rely on.", "https://m.media-amazon.com/images/M/MV5BNjIzMGY3MzMtNDVlMS00MGU1LTkyNTItMmI4Mzk0Mjg3OTBkXkEyXkFqcGc@._V1_.jpg", "Ben Affleck, Matt Damon, Scott Adkins, Kyle Chandler, Catalina Sandino Moreno, Steven Yeun, Teyana Taylor, and Sasha Calle in The Rip (2026)", "63", "R", "Released"
"The Hunger Games: Sunrise on the Reaping", "https://www.imdb.com/title/tt32558705/", "0", "0", "2026", "20/11/2026", "Action, Adventure, Drama", "9000", "Explores Panem 24 years before Katniss' saga, starting on the morning of the reaping for the 50th Hunger Games, where a young Haymitch Abernathy participates.", "https://m.media-amazon.com/images/M/MV5BNGRkYmM2MjUtZTY4Yi00YTNhLTk1MDEtYTQ3YjFiOTljM2Y1XkEyXkFqcGc@._V1_.jpg", "Joseph Zada, Laura Marcus, Jeffrey Lee Hallman, and Jhaleil Swaby in The Hunger Games: Sunrise on the Reaping (2026)", "", "", "Post-production"
"S4: The Bob Lazar Story", "https://www.imdb.com/title/tt37605896/", "7.6", "1170", "2026", "3/4/2026", "Documentary", "6840", "From jet engines to Los Alamos, Bob Lazar's life is rooted in science. In 1988, hired at S4 near Area 51, he reverse-engineered alien tech. Narrated by Lazar, this film uses exclusive footage to reveal America's best-kept secret.", "https://m.media-amazon.com/images/M/MV5BNDA2OGIzNWYtMWY2OS00NWUwLWFlNzItOTc2ZGI3YzFkYWU5XkEyXkFqcGc@._V1_.jpg", "Bob Lazar in S4: The Bob Lazar Story (2026)", "", "13+", "Released"
"Supergirl", "https://www.imdb.com/title/tt8814476/", "0", "0", "2026", "26/6/2026", "Action, Adventure, Sci-Fi", "", "Kara Zor-El, aka Supergirl, joins forces with an unlikely companion on an interstellar journey of vengeance and justice when an unexpected adversary strikes too close to home.", "https://m.media-amazon.com/images/M/MV5BNjlhMTdmODYtOGE0ZC00YzAwLWI1NDMtMTIzZDQzZGVkNDMwXkEyXkFqcGc@._V1_.jpg", "Milly Alcock in Supergirl (2026)", "", "", "In Production"
"A Great Awakening", "https://www.imdb.com/title/tt33305882/", "7.5", "522", "2026", "3/4/2026", "Drama, History", "7740", "One of the most defining moments in American history is the story of an unlikely friendship between the Reverend George Whitefield and Benjamin Franklin.", "https://m.media-amazon.com/images/M/MV5BY2RiZDRmOWEtMDU5Ny00ZDk2LWIzZWItNDE4NWRlYmE5Y2I1XkEyXkFqcGc@._V1_.jpg", "A Great Awakening (2026)", "", "PG-13", "Released"
"Beast", "https://www.imdb.com/title/tt7708226/", "6.2", "179", "2026", "10/4/2026", "Action, Drama, Sport", "6840", "MMA legend Patton James, now a commercial fisherman, is pulled back into the cage when his brother is in danger. Reuniting with his old coach Sammy, he commits to one final fight in ONE Championship against its brutal champion Xavier Grau.", "https://m.media-amazon.com/images/M/MV5BYjQ0OTgwZGUtNDhlYi00ZTM5LWI2NmYtNGYwYWJhNzVlYTc5XkEyXkFqcGc@._V1_.jpg", "Russell Crowe and Daniel MacPherson in Beast (2026)", "", "R", "Released"
"Reminders of Him", "https://www.imdb.com/title/tt33714084/", "6.4", "4898", "2026", "13/3/2026", "Drama, Romance", "6840", "After prison, a woman attempts to reconnect with her young daughter but faces resistance from everyone except a bar owner with ties to her child. As they grow closer, she must confront her past mistakes to build a hopeful future.", "https://m.media-amazon.com/images/M/MV5BNjI4OGM1NDEtYzA1NS00ZDg3LWFmZjUtMjg1MGQ4MTk3NjQzXkEyXkFqcGc@._V1_.jpg", "Maika Monroe in Reminders of Him (2026)", "49", "PG-13", "Released"
"O' Romeo", "https://www.imdb.com/title/tt31969779/", "5.4", "22449", "2026", "13/2/2026", "Action, Crime, Drama", "10680", "In post-independence Mumbai, the underworld rises amidst a changing city. This gritty tale explores the criminal landscape of a bygone era, weaving through the streets and shadows of India's bustling metropolis.", "https://m.media-amazon.com/images/M/MV5BZTQzZTgyODItYzg5My00YzhhLWFlYzctYTljM2E5NWI5NDcyXkEyXkFqcGc@._V1_.jpg", "Nana Patekar, Shahid Kapoor, Tamannaah Bhatia, Avinash Tiwary, Vikrant Massey, Disha Patani, and Triptii Dimri in O' Romeo (2026)", "", "", "Released"
"Spider-Man: Brand New Day", "https://www.imdb.com/title/tt22084616/", "0", "0", "2026", "31/7/2026", "Action, Adventure, Fantasy", "", "Four years after No Way Home, a forgotten Peter Parker lives alone as a full-time Spider-Man until mounting pressure triggers a dangerous change and a powerful new enemy emerges.", "https://m.media-amazon.com/images/M/MV5BODcwNmI0YjQtODg4MS00YTg4LWEwZjYtZjBiNGJmZDE0ODA3XkEyXkFqcGc@._V1_.jpg", "Spider-Man: Brand New Day (2026)", "", "", "Completed"
"Mortal Kombat II", "https://www.imdb.com/title/tt17490712/", "0", "0", "2026", "8/5/2026", "Action, Adventure, Fantasy", "6960", "The fan favorite champions -- now joined by Johnny Cage himself -- are pitted against one another in the ultimate battle to defeat the dark rule of Shao Kahn that threatens the very existence of the Earthrealm and its defenders.", "https://m.media-amazon.com/images/M/MV5BNTg2YWNkN2EtMzc1Ny00ZTBhLWFmYTItMmMyNzhjNjhhNmVhXkEyXkFqcGc@._V1_.jpg", "Tadanobu Asano, Damon Herriman, Josh Lawson, Hiroyuki Sanada, Karl Urban, Ana Thu Nguyen, CJ Bloomfield, Lewis Tan, Mehcad Brooks, Chin Han, Jessica McNamee, Joe Taslim, Ludi Lin, Desmond Chiam, Max Huang, Tati Gabrielle, Martyn Ford, and Adeline Rudolph in Mortal Kombat II (2026)", "", "R", "Completed"
"Mother Mary", "https://www.imdb.com/title/tt27200708/", "4.4", "208", "2026", "17/4/2026", "Drama, Music, Thriller", "6720", "Long-buried wounds rise to the surface when iconic pop star Mother Mary reunites with her estranged best friend and former costume designer, Sam Anselm, on the eve of her comeback performance.", "https://m.media-amazon.com/images/M/MV5BZWM0NTIzMWEtOWU1ZC00OTEyLThmNTItYjM1N2Y1MDllMGYzXkEyXkFqcGc@._V1_.jpg", "Anne Hathaway in Mother Mary (2026)", "", "R", "Released"
"Psycho Killer", "https://www.imdb.com/title/tt1764551/", "4.7", "2283", "2026", "20/2/2026", "Crime, Drama, Horror", "5460", "A police officer tracks a killer after her husband, a highway patrolman, becomes one of his victims.", "https://m.media-amazon.com/images/M/MV5BNmM1MWQzYmUtNjhiOS00N2RlLWJjMDUtNGM1YTQ1ZWZlZmRkXkEyXkFqcGc@._V1_.jpg", "James Preston Rogers in Psycho Killer (2026)", "26", "R", "Released"
"The Magic Faraway Tree", "https://www.imdb.com/title/tt7734244/", "6.8", "1628", "2026", "21/8/2026", "Adventure, Family, Fantasy", "6600", "A modern family relocates to the countryside where the children discover a magical tree with eccentric residents. They're transported to fantastical lands, rekindling their family bond through adventures.", "https://m.media-amazon.com/images/M/MV5BNGUzNzQzNWQtZTI2My00YmE2LTkyYzItNzFhMTM3OTVkYmNlXkEyXkFqcGc@._V1_.jpg", "Rebecca Ferguson, Phoenix Laroche, Andrew Garfield, Nicola Coughlan, and Claire Foy in The Magic Faraway Tree (2026)", "", "PG", "Released"
"Feel My Voice", "https://www.imdb.com/title/tt38589464/", "6.5", "688", "2026", "3/4/2026", "Comedy, Drama", "6360", "A teenager, the only hearing member of a deaf family, finds her voice and learns to believe in herself through her passion for singing.", "https://m.media-amazon.com/images/M/MV5BZWZlNDE5ZTgtMGRmNi00ZmY1LTk3ZTQtNDdhYzM1OGQ2M2VlXkEyXkFqcGc@._V1_.jpg", "Feel My Voice (2026)", "", "TV-MA", "Released"
"Avengers: Doomsday", "https://www.imdb.com/title/tt21357150/", "0", "0", "2026", "18/12/2026", "Action, Adventure, Sci-Fi", "", "Plot under wraps.", "https://m.media-amazon.com/images/M/MV5BM2E1ZTJiZTgtZGI2Zi00MzAxLThhZjktMmU3M2E3Yzk3NjUxXkEyXkFqcGc@._V1_.jpg", "Greg D'Agostino in Avengers: Doomsday (2026)", "", "", "Post-production"
