name, rating, votes, link, image, plot, genres, runtime, certificate, keywords, countriesOfOrigin, meterRanking, meterRankChange, directors, writers, stars, topCast, budget, openingWeekendGross, lifetimeGross, worldwideGross, filmingLocations, spokenLanguages, soundMix, aspectRatio, color, awardWins, awardNominations, titleType, isSeries, isEpisode, isAdult

"Obsession", "8.1", "87586", "https://www.imdb.com/title/tt37287335/", "https://m.media-amazon.com/images/M/MV5BYzc1NWUwMDgtNGZlMS00ZmYzLWIzMzktNmMxMmY1MTUzNWExXkEyXkFqcGc@._V1_.jpg", "After breaking the mysterious &quot;One Wish Willow&quot; to win his crush&apos;s heart, a hopeless romantic finds himself getting exactly what he asked for but soon discovers that some desires come at a dark, sinister price.", "Horror, Romance, Thriller", "108", "R", "crush, wish, death of cat, male rear nudity, male nudity", "US", "1", "UP 1", "Curry Barker", "", "Michael Johnston, Inde Navarrette, Cooper Tomlinson", "Michael Johnston, Inde Navarrette, Cooper Tomlinson, Megan Lawless", "USD 750,000", "USD 17,196,855", "USD 156,133,260", "USD 229,414,260", "Los Angeles, California, USA", "English", "D-Cinema 48kHz 5.1, Dolby Atmos, Dolby Digital", "1.50 : 1", "Color", "5", "4", "Movie", "False", "False", "False"
"Backrooms", "7.1", "62808", "https://www.imdb.com/title/tt26657236/", "https://m.media-amazon.com/images/M/MV5BYzQyYjZmMjctMzIyZi00MDI0LWJhNGQtMzQ3MTFlNDgwNGM5XkEyXkFqcGc@._V1_.jpg", "After a therapist&apos;s patient disappears into a dimension beyond reality, she must venture into the unknown to save him.", "Horror, Sci-Fi, Thriller", "110", "R", "creepypasta, psychological horror, backrooms, found footage horror, analog horror", "US", "2", "DOWN 1", "Kane Parsons", "Will Soodik, Kane Parsons", "Chiwetel Ejiofor, Renate Reinsve, Mark Duplass", "Chiwetel Ejiofor, Renate Reinsve, Mark Duplass, Finn Bennett", "USD 10,000,000", "USD 81,402,424", "USD 138,661,974", "USD 216,261,974", "15 King Edward Street, Coquitlam, British Columbia, Canada", "English, Portuguese, Turkish, Arabic, Japanese", "Dolby Atmos", "1.85 : 1", "Color", "0", "0", "Movie", "False", "False", "False"
"Masters of the Universe", "7.1", "22813", "https://www.imdb.com/title/tt0427340/", "https://m.media-amazon.com/images/M/MV5BMTJjYTFkM2EtZjBmNy00OTk2LTg0NTAtNzYxYzlmNjhkMzQ5XkEyXkFqcGc@._V1_.jpg", "A young man on Earth discovers a fabulous secret legacy as the prince of an alien planet, and must recover a magic sword and return home to protect his kingdom.", "Action, Adventure, Fantasy", "140", "PG-13", "masters of the universe, beefcake, superhero, magical sword, prince", "US", "3", "UP 9", "Travis Knight", "Chris Butler, Aaron Nee, Adam Nee", "Nicholas Galitzine, Camila Mendes, Idris Elba", "Nicholas Galitzine, Camila Mendes, Idris Elba, Jared Leto", "", "USD 29,439,929", "USD 31,538,352", "USD 56,538,352", "London, England, UK", "English", "Dolby Atmos, Dolby Digital, IMAX 6-Track", "2.39 : 1", "Color", "0", "0", "Movie", "False", "False", "False"
"Scary Movie", "5.4", "18180", "https://www.imdb.com/title/tt32093575/", "https://m.media-amazon.com/images/M/MV5BNTJjMDk1NzAtMGVmNS00NTFmLWFlOTQtZDk5M2I2NjZiZDdlXkEyXkFqcGc@._V1_.jpg", "Two friends find themselves caught up in mayhem involving killers, monsters and supernatural creatures once again.", "Comedy, Horror", "96", "R", "crude humor comedy, slasher horror, criticism to republican party, pubic hair, diaper wearing woman", "US", "4", "UP 23", "Michael Tiddes", "Shawn Wayans, Marlon Wayans, Buddy Johnson", "Marlon Wayans, Shawn Wayans, Anna Faris", "Marlon Wayans, Shawn Wayans, Anna Faris, Regina Hall", "USD 30,000,000", "USD 54,336,626", "USD 58,464,337", "USD 113,498,241", "Tyler Perry Studios, Atlanta, Georgia, USA", "English", "Dolby Digital, Dolby Atmos", "2.39 : 1", "Color", "0", "1", "Movie", "False", "False", "False"
"Office Romance", "5.9", "10915", "https://www.imdb.com/title/tt33397980/", "https://m.media-amazon.com/images/M/MV5BZmM0MDlhOTMtNjYxYy00MGI4LWEwODQtZTEyOTFhZTUyMTllXkEyXkFqcGc@._V1_.jpg", "Jackie, President and CEO of Air Cruz, runs a tight ship in her business, including a rigid anti-fraternization policy for all her employees, which is severely tested when a sexy new lawyer begins working for her.", "Comedy, Romance", "114", "R", "romantic comedy", "US", "5", "UP 188", "Ol Parker", "Brett Goldstein, Joe Kelly", "Jennifer Lopez, Brett Goldstein, Betty Gilpin", "Jennifer Lopez, Brett Goldstein, Betty Gilpin, Edward James Olmos", "", "", "", "", "Kenilworth, New Jersey, USA", "English", "", "2.35 : 1", "Color", "0", "0", "Movie", "False", "False", "False"
"Michael", "7.6", "120274", "https://www.imdb.com/title/tt11378946/", "https://m.media-amazon.com/images/M/MV5BNzllNmRlN2EtMDQyOC00ODJjLTg4OWQtZDNmNGU3YzlkNjc1XkEyXkFqcGc@._V1_.jpg", "The early life of musician Michael Jackson, from the discovery of his talent as the lead of the Jackson Five to the artist whose creative ambition fueled a pursuit to become the biggest entertainer in the world.", "Biography, Drama, History", "127", "PG-13", "michael jackson character, king of pop, based on true story, song, based on real people", "US", "6", "DOWN 2", "Antoine Fuqua", "", "Jaafar Jackson, Nia Long, Colman Domingo", "Jaafar Jackson, Nia Long, Colman Domingo, Juliano Valdi", "USD 155,000,000", "USD 97,206,874", "USD 355,266,918", "USD 889,366,918", "Sony Pictures Studios - 10202 W. Washington Blvd., Culver City, California, USA", "English", "Dolby Digital, IMAX 6-Track, IMAX 5.0, Dolby Atmos, Dolby Surround 7.1", "1.85 : 1", "Color", "2", "4", "Movie", "False", "False", "False"
"Hoppers", "7.3", "58891", "https://www.imdb.com/title/tt26443616/", "https://m.media-amazon.com/images/M/MV5BNzRiMzZlMTMtNmU3OC00MDUwLThmNDUtMTBjZmQ3MWQ4NTljXkEyXkFqcGc@._V1_.jpg", "A 19-year-old animal lover uses technology that places her consciousness into a robotic beaver to uncover mysteries within the animal world beyond her imagination.", "Animation, Adventure, Comedy", "104", "PG", "robot, nature lover, soul transference, beaver, scientist", "US", "7", "UP 64", "Daniel Chong", "Jesse Andrews, Daniel Chong, Jordan Harrison", "Piper Curda, Bobby Moynihan, Jon Hamm", "Piper Curda, Bobby Moynihan, Jon Hamm, Kathy Najimy", "USD 150,000,000", "USD 45,349,801", "USD 166,010,783", "USD 372,010,783", "", "English", "Dolby Digital, DTS:X, IMAX 6-Track, Dolby Atmos, Dolby Surround 7.1", "1.85 : 1", "Color", "0", "1", "Movie", "False", "False", "False"
"Disclosure Day", "6.9", "15230", "https://www.imdb.com/title/tt15047880/", "https://m.media-amazon.com/images/M/MV5BMTgwNDI1ZjctYWNmMS00MTJhLTg1ZWItMzI1Yjk5NjZkYWFkXkEyXkFqcGc@._V1_.jpg", "If you found out we weren&apos;t alone, if someone showed you, proved it to you, would that frighten you?", "Action, Drama, Mystery", "145", "PG-13", "alien invasion sci fi, supernatural fantasy, suspense mystery, cosmic horror, extreme close up of eyes", "US", "8", "UP 2", "Steven Spielberg", "David Koepp, Steven Spielberg", "Emily Blunt, Josh O'Connor, Colin Firth", "Emily Blunt, Josh O'Connor, Colin Firth, Eve Hewson", "", "", "", "", "New Jersey, USA", "English", "70 mm 6-Track, Dolby Atmos, Dolby Surround 5.1, IMAX 6-Track, Dolby Surround 7.1", "2.39 : 1", "Color", "0", "3", "Movie", "False", "False", "False"
"Project Hail Mary", "8.3", "352121", "https://www.imdb.com/title/tt12042730/", "https://m.media-amazon.com/images/M/MV5BNTkwNzJiYTctNzI3NC00NjE1LTlhYjktY2Q5MTdmMWFmNzcxXkEyXkFqcGc@._V1_.jpg", "A science teacher wakes up alone on a spaceship. As his memory returns, he uncovers a mission to stop a mysterious substance killing Earth&apos;s sun, and realizes that an unexpected friendship may be the key.", "Adventure, Comedy, Drama", "156", "PG-13", "outer space, alien, space sci fi, astronaut, teacher", "US", "9", "DOWN 3", "", "Drew Goddard, Andy Weir", "Ryan Gosling, Sandra Hüller, James Ortiz", "Ryan Gosling, Sandra Hüller, James Ortiz, Lionel Boyce", "USD 200,000,000", "USD 80,506,007", "USD 343,403,886", "USD 680,212,034", "South Parade Pier, Southsea, Portsmouth, Hampshire, England, UK", "English", "Dolby Atmos, IMAX 6-Track, Dolby Digital", "2.00 : 1", "Color", "1", "5", "Movie", "False", "False", "False"
"The Mandalorian and Grogu", "7", "59780", "https://www.imdb.com/title/tt30825738/", "https://m.media-amazon.com/images/M/MV5BYjRkYzAzNjktZmRhMy00NjRiLWE0OTMtYmRmMTE5NDkzY2NlXkEyXkFqcGc@._V1_.jpg", "Once a lone bounty hunter, Mandalorian Din Djarin and his apprentice Grogu embark on an exciting new Star Wars adventure.", "Action, Adventure, Family", "132", "PG-13", "star wars, space sci fi, space adventure, epic sci fi, epic fantasy", "US", "10", "DOWN 7", "Jon Favreau", "Jon Favreau, Dave Filoni, Noah Kloor", "Pedro Pascal, Brendan Wayne, Lateef Crowder", "Pedro Pascal, Brendan Wayne, Lateef Crowder, Sigourney Weaver", "", "USD 81,670,433", "USD 156,855,061", "USD 294,655,061", "Los Angeles, California, USA", "English", "Dolby Atmos, IMAX 6-Track, Auro 11.1, Dolby Surround 7.1, Dolby Digital, DTS:X, Dolby Surround 5.1", "2.39 : 1", "Color", "0", "3", "Movie", "False", "False", "False"
"Hokum", "6.8", "31509", "https://www.imdb.com/title/tt35672862/", "https://m.media-amazon.com/images/M/MV5BZjA1ZjFlZGItNTVjZC00NTFhLTg2YTEtODMzODRmNGFiNTdmXkEyXkFqcGc@._V1_.jpg", "A horror writer visits an Irish inn to scatter his parents&apos; ashes, unaware the property is said to be haunted by a witch.", "Horror, Thriller", "107", "R", "haunted hotel room, hotel, supernatural horror, psychological horror, witch horror", "IE", "11", "UP 19", "Damian McCarthy", "", "Adam Scott, Peter Coonan, David Wilmot", "Adam Scott, Peter Coonan, David Wilmot, Florence Ordesh", "", "USD 6,428,305", "USD 16,956,360", "USD 23,927,856", "Skibbereen, Co. Cork, Ireland", "English", "Dolby Atmos", "2.39 : 1", "Color", "0", "0", "Movie", "False", "False", "False"
"In the Grey", "6.3", "17118", "https://www.imdb.com/title/tt27681354/", "https://m.media-amazon.com/images/M/MV5BMTZkMTIzMTItMTQwZS00MTg4LWE0MTEtM2NiNmUzYjRmMGUxXkEyXkFqcGc@._V1_.jpg", "A covert team of elite operatives are living in the shadows. When a ruthless despot steals a billion-dollar fortune, they&apos;re sent to take it back-an impossible heist that erupts into a deadly game of strategy, deception and survival.", "Action, Drama, Thriller", "98", "R", "escape, jeddah saudi arabia, flashback, asset seizure, slow motion shot", "GB", "12", "UP 28", "Guy Ritchie", "", "Henry Cavill, Jake Gyllenhaal, Eiza González", "Henry Cavill, Jake Gyllenhaal, Eiza González, Carlos Bardem", "", "USD 2,926,879", "USD 5,723,890", "USD 17,339,364", "Tenerife, Canary Islands, Spain", "English", "Dolby Atmos, Dolby Digital", "2.39 : 1", "Color", "0", "0", "Movie", "False", "False", "False"
"The Odyssey", "0", "0", "https://www.imdb.com/title/tt33764258/", "https://m.media-amazon.com/images/M/MV5BZDY2NTkxMWQtMmNkMC00NmNjLWIzMmItNmEyMmRmMDk2YmY2XkEyXkFqcGc@._V1_.jpg", "After the Trojan War, Odysseus faces a dangerous voyage back to Ithaca, meeting creatures like the Cyclops Polyphemus, Sirens, and Calypso along the way.", "Adventure, Drama, Fantasy", "172", "R", "ancient greece, greek, based on epic poem, epic poem, odysseus character", "GB", "13", "UP 11", "Christopher Nolan", "Christopher Nolan, Homer", "Matt Damon, Tom Holland, Anne Hathaway", "Matt Damon, Tom Holland, Anne Hathaway, Robert Pattinson", "USD 250,000,000", "", "", "", "Messinia, Peloponnese region, Greece", "English", "IMAX 6-Track, Dolby Atmos, Dolby Surround 7.1, Dolby Surround 5.1, Dolby Digital", "", "Color", "0", "0", "Movie", "False", "False", "False"
"Ladies First", "5.8", "23977", "https://www.imdb.com/title/tt34611082/", "https://m.media-amazon.com/images/M/MV5BNjBhMjk2NmQtY2JhOC00OTIzLTkzZjItNjA2NWM3OTkzNzA5XkEyXkFqcGc@._V1_.jpg", "A male chauvinist is transported to a matriarchal society, facing challenges from a formidable female version of himself.", "Comedy", "90", "R", "film adaptation, north american adaptation of french source material, american adaptation of french source material, american adaptation of european source material, adaptation", "US", "14", "DOWN 9", "Thea Sharrock", "Natalie Krinsky, Cinco Paul, Katie Silberman", "Sacha Baron Cohen, Rosamund Pike, Tom Davis", "Sacha Baron Cohen, Rosamund Pike, Tom Davis, Emily Mortimer", "", "", "", "", "", "English", "Dolby Atmos", "2.39 : 1", "Color", "0", "0", "Movie", "False", "False", "False"
"Pressure", "7.6", "3452", "https://www.imdb.com/title/tt32547691/", "https://m.media-amazon.com/images/M/MV5BMjE2YjdkNDctMDg1MS00MjBjLWIyZjEtZWM1ZjczNTAzZGEyXkEyXkFqcGc@._V1_.jpg", "In the tense 72 hours before D-Day, General Dwight D. Eisenhower and Captain James Stagg face an impossible choice--launch the most dangerous seaborne invasion in history or risk losing the war altogether.", "Drama, History, Thriller", "100", "PG-13", "world war two, seaborne invasion, invasion, d day, bloody water", "GB", "15", "DOWN 2", "Anthony Maras", "David Haig, Anthony Maras", "Andrew Scott, Brendan Fraser, Kerry Condon", "Andrew Scott, Brendan Fraser, Kerry Condon, Chris Messina", "", "USD 5,811,480", "USD 11,635,050", "USD 11,686,760", "Camber Sands, Camber, East Sussex, England, UK", "English", "", "", "Color", "1", "0", "Movie", "False", "False", "False"
"Remarkably Bright Creatures", "7.7", "34239", "https://www.imdb.com/title/tt33100314/", "https://m.media-amazon.com/images/M/MV5BNzM3OTRlZDktYTk0OS00OTlmLWFhMjctMTZiODU4N2RiYzhhXkEyXkFqcGc@._V1_.jpg", "Through unlikely bonds formed during night shifts at a local aquarium, Tova, an elderly widow, learns of a life-changing discovery that may bring her joy and wonder once again.", "Comedy, Drama", "111", "PG-13", "octopus, reference to slipknot, car breaks down, camper van, loss of son", "US", "16", "DOWN 8", "Olivia Newman", "Olivia Newman, John Whittington, Shelby Van Pelt", "Sally Field, Lewis Pullman, Colm Meaney", "Sally Field, Lewis Pullman, Colm Meaney, Joan Chen", "", "", "", "", "Maple Ridge, British Columbia, Canada", "English", "Dolby Digital", "1.85 : 1", "Color", "0", "2", "Movie", "False", "False", "False"
"Apex", "6.1", "87642", "https://www.imdb.com/title/tt16431404/", "https://m.media-amazon.com/images/M/MV5BNjUzODE2ZWYtMDdiMS00ZTA0LWI4MzEtNDkyODNiNmIwMWY1XkEyXkFqcGc@._V1_.jpg", "A mountain climber haunted by a fatal decision in Norway retreats to the Australian wilderness for isolation. Her journey turns into a desperate hunt when a deceptive local targets her as his next ritualistic prey in the bush.", "Action, Thriller", "95", "R", "serial killer, river, survival adventure, climbing, australia", "US", "17", "DOWN 6", "Baltasar Kormákur", "", "Charlize Theron, Taron Egerton, Eric Bana", "Charlize Theron, Taron Egerton, Eric Bana, Matt Whelan", "", "", "", "", "Blue Mountains, New South Wales, Australia", "English", "Dolby Atmos", "2.20 : 1", "Color", "0", "1", "Movie", "False", "False", "False"
"The Sheep Detectives", "7.6", "19108", "https://www.imdb.com/title/tt32565993/", "https://m.media-amazon.com/images/M/MV5BNTFmZWI4YmMtNmQ0ZC00ZGQwLTk1OWEtZjAyZmIzOGY0MGFiXkEyXkFqcGc@._V1_.jpg", "Every night a shepherd reads aloud a murder mystery, pretending his sheep can understand. When he is found dead, the sheep realize at once that it was a murder and think they know everything about how to go about solving it.", "Comedy, Family, Mystery", "109", "PG", "whodunnit mystery, whodunit, animals family, sheep, shepherd", "IE", "18", "DOWN 9", "Kyle Balda", "Craig Mazin, Leonie Swann", "Hugh Jackman, Brett Goldstein, Patrick Stewart", "Hugh Jackman, Brett Goldstein, Patrick Stewart, Regina Hall", "USD 75,000,000", "USD 15,087,796", "USD 59,790,243", "USD 115,090,243", "Shepperton Studios, Surrey, England, UK", "English", "Dolby Digital, Dolby Atmos", "2.00 : 1", "Color", "1", "0", "Movie", "False", "False", "False"
"Jack Ryan: Ghost War", "5.7", "23584", "https://www.imdb.com/title/tt34378301/", "https://m.media-amazon.com/images/M/MV5BZGY2MDU2Y2YtOTkzNC00MTY4LThkODYtNWIxNmRlZmRjZWJlXkEyXkFqcGc@._V1_.jpg", "Follows Jack Ryan who reunites with CIA operatives to navigate a treacherous web of betrayal against an enemy who knows their every move, facing a past they thought was long put to rest.", "Action, Drama, Thriller", "105", "R", "spy, new york city, jogging, foot chase, cia director", "US", "19", "DOWN 12", "Andrew Bernstein", "Aaron Rabin, John Krasinski, Noah Oppenheim", "John Krasinski, Wendell Pierce, Sienna Miller", "John Krasinski, Wendell Pierce, Sienna Miller, Michael Kelly", "", "", "", "", "London, Greater London, England, UK", "English", "Dolby Digital, Dolby Atmos", "2.39 : 1, 2.39:1", "Color", "0", "0", "Movie", "False", "False", "False"
"Maa Behen", "5.5", "2831", "https://www.imdb.com/title/tt33538438/", "https://m.media-amazon.com/images/M/MV5BZGZjMGRjN2QtZWM4Ni00NjVjLWFjZjMtMmJmNjg2ZjQ1ZmZmXkEyXkFqcGc@._V1_.jpg", "Rekha and her daughters Jaya and Sushma, controversial figures in their conservative neighborhood, discover a dead body in their kitchen. The struggling, squabbling mother-daughter trio must work together to cover up the crime.", "Comedy, Crime, Drama", "127", "TV-14", "dark comedy, bollywood musical", "IN", "20", "UP 3139", "Suresh Triveni", "Pooja Tolani, Suresh Triveni", "Madhuri Dixit, Triptii Dimri, Ravi Kishan", "Madhuri Dixit, Triptii Dimri, Ravi Kishan, Dharna Durga", "", "", "", "", "", "Hindi", "Dolby Atmos", "2.00 : 1", "Color", "0", "0", "Movie", "False", "False", "False"
"Iron Lung", "5.9", "26014", "https://www.imdb.com/title/tt27564844/", "https://m.media-amazon.com/images/M/MV5BYzkxOGU1YmQtNDc0Ni00M2JhLWFlZjktODMzOGU3MjQxMTQ0XkEyXkFqcGc@._V1_.jpg", "In a post-apocalyptic future after &quot;The Quiet Rapture&quot; event, a convict explores a blood ocean on a desolate moon using a submarine called the &quot;Iron Lung&quot; to search for missing stars/planets.", "Horror, Sci-Fi", "125", "R", "post apocalypse, based on video game, space sci fi, psychological horror, body horror", "US", "21", "DOWN 3", "Mark Fischbach", "Mark Fischbach, David Szymanski", "Mark Fischbach, Caroline Kaplan, Troy Baker", "Mark Fischbach, Caroline Kaplan, Troy Baker, Elsie Lovelock", "USD 3,000,000", "USD 17,800,000", "USD 40,851,941", "USD 50,036,487", "Austin, Texas, USA", "English", "Dolby Digital", "1.85 : 1", "Color", "0", "2", "Movie", "False", "False", "False"
"Hai Jawani Toh Ishq Hona Hai", "6", "11400", "https://www.imdb.com/title/tt30447822/", "https://m.media-amazon.com/images/M/MV5BZWE1OTg5ZDMtYjllZC00YzE2LTg1N2UtZmI0OTBmMWE3NzFkXkEyXkFqcGc@._V1_.jpg", "When differences over family planning end Jass and Bani&apos;s marriage, Jass begins a new romance abroad, only to become entangled in unexpected secrets and complicated relationships.", "Comedy, Drama, Romance", "136", "", "romantic comedy", "IN", "22", "UP 1749", "David Dhawan", "David Dhawan, Yunus Sajawal, Farhad Samji", "Varun Dhawan, Pooja Hegde, Mrunal Thakur", "Varun Dhawan, Pooja Hegde, Mrunal Thakur, Maniesh Paul", "", "", "", "", "Glasgow, Scotland, UK", "Hindi", "Dolby Digital, Dolby Atmos", "2.39:1", "Color", "0", "0", "Movie", "False", "False", "False"
"Mortal Kombat II", "6.5", "45689", "https://www.imdb.com/title/tt17490712/", "https://m.media-amazon.com/images/M/MV5BNTg2YWNkN2EtMzc1Ny00ZTBhLWFmYTItMmMyNzhjNjhhNmVhXkEyXkFqcGc@._V1_.jpg", "The fan favorite champions -- now joined by Johnny Cage himself -- are pitted against one another in the ultimate battle to defeat the dark rule of Shao Kahn that threatens the very existence of the Earthrealm and its defenders.", "Action, Adventure, Fantasy", "116", "R", "mortal kombat, based on video game, martial arts, dark fantasy, sequel", "US", "23", "DOWN 9", "Simon McQuoid", "Jeremy Slater, Ed Boon, John Tobias", "Adeline Rudolph, Karl Urban, Martyn Ford", "Adeline Rudolph, Karl Urban, Martyn Ford, Tati Gabrielle", "USD 68,000,000", "USD 38,501,177", "USD 79,168,053", "USD 128,068,053", "Village Roadshow Studios, Oxenford, Queensland, Australia", "English, Spanish", "Dolby Digital, Dolby Surround 7.1, IMAX 6-Track, Auro 11.1, Dolby Atmos", "2.39 : 1", "Color", "0", "0", "Movie", "False", "False", "False"
"Send Help", "6.7", "120712", "https://www.imdb.com/title/tt8036976/", "https://m.media-amazon.com/images/M/MV5BOTgxOWY5NTMtYjdiNi00NTIyLTkwMTQtMWNjM2IzYTU0ODgyXkEyXkFqcGc@._V1_.jpg", "An overworked analyst and her arrogant nepo-baby boss survive a plane crash near Thailand and must cooperate to survive on a remote jungle island while their workplace power dynamic collapses around them.", "Adventure, Horror, Thriller", "113", "R", "airplane crash, female rage, island, castaway, stranded on an island", "US", "24", "DOWN 1", "Sam Raimi", "Damian Shannon, Mark Swift", "Rachel McAdams, Dylan O'Brien, Edyll Ismail", "Rachel McAdams, Dylan O'Brien, Edyll Ismail, Dennis Haysbert", "USD 40,000,000", "USD 19,102,299", "USD 64,734,795", "USD 94,041,481", "Thailand", "English", "IMAX 6-Track, 12-Track Digital Sound, Dolby Atmos, DTS:X, SDDS", "2.39 : 1", "Color", "0", "0", "Movie", "False", "False", "False"
"Toy Story 5", "0", "0", "https://www.imdb.com/title/tt29355505/", "https://m.media-amazon.com/images/M/MV5BZTI1YTBiNmEtYWUxZi00YzFkLWIzNjMtMmZjMmY2NzM0ZWMzXkEyXkFqcGc@._V1_.jpg", "Woody, Buzz, Jessie and the rest of the gang&apos;s jobs are challenged when they&apos;re introduced to electronics, a new threat to playtime.", "Animation, Adventure, Comedy", "102", "PG", "sequel, talking toy, buzz lightyear character, dinosaur, cowboy toy", "US", "25", "UP 7", "", "Andrew Stanton, McKenna Harris", "Tom Hanks, Keanu Reeves, Alan Cumming", "Tom Hanks, Keanu Reeves, Alan Cumming, Joan Cusack", "", "", "", "", "Pixar Animation Studios - 1200 Park Avenue, Emeryville, California, USA", "English", "Sonics-DDP, Auro 11.1, D-Cinema 96kHz Dolby Surround 7.1, Dolby Atmos, Dolby Digital, 12-Track Digital Sound, Dolby Surround 7.1, D-Cinema 96kHz 7.1, DTS:X", "1.85 : 1", "", "0", "2", "Movie", "False", "False", "False"
"Cape Fear", "7.3", "244610", "https://www.imdb.com/title/tt0101540/", "https://m.media-amazon.com/images/M/MV5BNTBkNTYwZTctOTgxYS00ZmIyLTgzNDAtODJhZjg2MDUwNmFlXkEyXkFqcGc@._V1_.jpg", "A convicted rapist, released from prison after serving a fourteen-year sentence, stalks the family of the lawyer who originally defended him.", "Crime, Drama, Thriller", "128", "R", "brutal rape, houseboat, attempted rape, home invasion, bible quote", "US", "26", "UP 186", "Martin Scorsese", "John D. MacDonald, James R. Webb, Wesley Strick", "Robert De Niro, Nick Nolte, Jessica Lange", "Robert De Niro, Nick Nolte, Jessica Lange, Juliette Lewis", "USD 35,000,000", "USD 10,261,025", "USD 79,091,969", "USD 182,291,969", "Savannah, Georgia, USA", "English", "Dolby SR, Dolby Digital", "2.35 : 1", "Color", "5", "21", "Movie", "False", "False", "False"
"Supergirl", "0", "0", "https://www.imdb.com/title/tt8814476/", "https://m.media-amazon.com/images/M/MV5BNjlhMTdmODYtOGE0ZC00YzAwLWI1NDMtMTIzZDQzZGVkNDMwXkEyXkFqcGc@._V1_.jpg", "Kara Zor-El, aka Supergirl, joins forces with an unlikely companion on an interstellar journey of vengeance and justice when an unexpected adversary strikes too close to home.", "Action, Adventure, Drama", "107", "PG-13", "supergirl character, based on comic book, animal, pet, dog", "US", "27", "UP 35", "Craig Gillespie", "Ana Nogueira, Jerry Siegel, Joe Shuster", "Milly Alcock, Eve Ridley, Matthias Schoenaerts", "Milly Alcock, Eve Ridley, Matthias Schoenaerts, Jason Momoa", "USD 175,000,000", "", "", "", "Iceland", "English", "Dolby Digital, Dolby Atmos, IMAX 6-Track", "2.39 : 1", "Color", "0", "2", "Movie", "False", "False", "False"
"The Devil Wears Prada 2", "6.6", "57006", "https://www.imdb.com/title/tt33612209/", "https://m.media-amazon.com/images/M/MV5BZmM3ZDU3ODItZmY5Yi00OTQ2LWE5OTctZTA5NDBhMWJkOGY3XkEyXkFqcGc@._V1_.jpg", "Andy Sachs reunites with Miranda Priestly as they navigate their careers amid the decline of traditional magazine publishing.", "Comedy, Drama", "119", "PG-13", "new york city, sequel, journalist, dior, fashion magazine", "US", "28", "DOWN 6", "David Frankel", "Aline Brosh McKenna, Lauren Weisberger", "Meryl Streep, Anne Hathaway, Emily Blunt", "Meryl Streep, Anne Hathaway, Emily Blunt, Stanley Tucci", "USD 100,000,000", "USD 76,747,075", "USD 215,312,353", "USD 663,912,353", "Kaufman Astoria Studios - 3412 36th Street, Astoria, Queens, New York City, New York, USA", "English, Italian, French", "Dolby Atmos", "2.39 : 1", "Color", "1", "4", "Movie", "False", "False", "False"
"Passenger", "5.6", "6159", "https://www.imdb.com/title/tt33763941/", "https://m.media-amazon.com/images/M/MV5BNDhmZmJlMDctNTA3MS00NTkwLThkZGQtMjM5MTdmMDg2YjBjXkEyXkFqcGc@._V1_.jpg", "After a young couple witnesses a gruesome highway accident, they soon realize they did not leave the crash scene alone, as a demonic presence called the Passenger won&apos;t stop until it claims them both.", "Horror, Thriller", "94", "R", "supernatural horror, psychological horror, road trip, one word title, old woman", "US", "29", "DOWN 8", "André Øvredal", "Zachary Donohue, T.W. Burgess", "Jacob Scipio, Lou Llobell, Melissa Leo", "Jacob Scipio, Lou Llobell, Melissa Leo, Joseph Lopez", "", "USD 8,746,797", "USD 17,513,357", "USD 29,713,357", "Seattle, Washington, USA", "English", "Dolby Atmos", "", "Color", "0", "0", "Movie", "False", "False", "False"
