"Superman", "7", "418357", "https://www.imdb.com/title/tt5950044/", "https://m.media-amazon.com/images/M/MV5BOGMwZGJiM2EtMzEwZC00YTYzLWIxNzYtMmJmZWNlZjgxZTMwXkEyXkFqcGc@._V1_.jpg", "Superman must reconcile his alien Kryptonian heritage with his human upbringing as reporter Clark Kent. As the embodiment of truth, justice and the American way he soon finds himself in a world that views these as old-fashioned.", "Action, Adventure, Sci-Fi", "129", "PG-13", "superhero, hero, dc universe, alien, comicbook movie", "US", "92", "UP 19", "James Gunn", "James Gunn, Jerry Siegel, Joe Shuster", "David Corenswet, Rachel Brosnahan, Nicholas Hoult", "David Corenswet, Rachel Brosnahan, Nicholas Hoult, Alan Tudyk", "USD 225,000,000", "USD 125,021,735", "USD 354,223,803", "USD 618,723,803", "Cincinnati, Ohio, USA", "English", "Dolby Atmos, IMAX 6-Track, DTS:X, 12-Track Digital Sound, SDDS, Dolby Surround 7.1, Auro 11.1", "1.85 : 1", "Color", "5", "75", "Movie", "False", "False", "False"
"Ready or Not: Here I Come", "6.5", "42814", "https://www.imdb.com/title/tt33978029/", "https://m.media-amazon.com/images/M/MV5BZTM3N2EyMTEtNDhkMi00ZjNiLWI0MWUtOGViMjExODY3YTJhXkEyXkFqcGc@._V1_.jpg", "After surviving one deadly game, Grace and her sister Faith must now outrun four rival families competing for a powerful throne - winner takes all.", "Comedy, Horror, Thriller", "108", "R", "dark comedy, sequel, satanic cult, splatter horror, woman bound and gagged", "US", "93", "DOWN 24", "", "Guy Busick, R. Christopher Murphy", "Samara Weaving, Kathryn Newton, Elijah Wood", "Samara Weaving, Kathryn Newton, Elijah Wood, Sarah Michelle Gellar", "USD 17,000,000", "USD 9,075,271", "USD 22,986,054", "USD 39,566,785", "Toronto, Ontario, Canada", "English", "Dolby Atmos, Dolby Digital", "2.39 : 1", "Color", "0", "1", "Movie", "False", "False", "False"
"28 Years Later: The Bone Temple", "7.2", "107169", "https://www.imdb.com/title/tt32141377/", "https://m.media-amazon.com/images/M/MV5BZGU2M2Y1YTItMWYxNS00NDYxLThhOTYtNjNhOWUzNjA3MTYwXkEyXkFqcGc@._V1_.jpg", "As Spike is inducted into Jimmy Crystal&apos;s gang on the mainland, Dr. Kelson makes a discovery that could alter the world.", "Horror, Sci-Fi, Thriller", "109", "R", "sequel, zombie, fear, post apocalypse, male frontal nudity", "GB", "94", "DOWN 16", "Nia DaCosta", "", "Jack O'Connell, Alfie Williams, Connor Newall", "Jack O'Connell, Alfie Williams, Connor Newall, Erin Kellyman", "USD 63,000,000", "USD 12,521,327", "USD 25,147,583", "USD 58,524,697", "Ennerdale, Cumbria, England, UK", "English", "Dolby Digital, Dolby Atmos", "2.39 : 1", "Color", "0", "3", "Movie", "False", "False", "False"
"The Ministry of Ungentlemanly Warfare", "6.8", "160616", "https://www.imdb.com/title/tt5177120/", "https://m.media-amazon.com/images/M/MV5BYmIxODc5ZjMtYzZmZS00OTE5LThkZDktNWNmODNiZjFhMDgyXkEyXkFqcGc@._V1_.jpg", "The British military recruits a small group of highly skilled soldiers to strike against German forces behind enemy lines during World War II.", "Action, Comedy, War", "122", "R", "minister, world war two, year 1939, black ops, gunfight", "US", "95", "DOWN 9", "Guy Ritchie", "Paul Tamasy, Eric Johnson, Arash Amel", "Henry Cavill, Alan Ritchson, Alex Pettyfer", "Henry Cavill, Alan Ritchson, Alex Pettyfer, Eiza González", "USD 60,000,000", "USD 8,913,698", "USD 20,535,053", "USD 29,768,915", "Antalya, Turkey", "English", "Dolby Digital, 12-Track Digital Sound, Dolby Surround 7.1, Auro 11.1, DTS:X", "2.39 : 1", "Color", "1", "2", "Movie", "False", "False", "False"
"War Machine", "6.3", "102928", "https://www.imdb.com/title/tt15940132/", "https://m.media-amazon.com/images/M/MV5BMmM1ZTc5ZTYtOTM2My00MjBmLWE5NzktYzkyYzdlYWE3ZDAzXkEyXkFqcGc@._V1_.jpg", "Follow the final recruits of a grueling special ops boot camp who encounter a mysterious deadly force.", "Action, Sci-Fi, Thriller", "106", "R", "u.s. army rangers, team action, army rangers, loss of brother, american soldier", "GB", "96", "DOWN 20", "Patrick Hughes", "Patrick Hughes, James Beaufort", "Alan Ritchson, Stephan James, Blake Richardson", "Alan Ritchson, Stephan James, Blake Richardson, Dennis Quaid", "", "", "", "USD 56,984", "Melbourne, Victoria, Australia", "English", "Dolby Atmos", "2.39 : 1", "Color", "0", "1", "Movie", "False", "False", "False"
"Inception", "8.8", "2824862", "https://www.imdb.com/title/tt1375666/", "https://m.media-amazon.com/images/M/MV5BMjAxMzY3NjcxNF5BMl5BanBnXkFtZTcwNTI5OTM0Mw@@._V1_.jpg", "A thief who steals corporate secrets through the use of dream-sharing technology is given the inverse task of planting an idea into the mind of a CEO, but his tragic past may doom the project and his team to disaster.", "Adventure, Sci-Fi, Thriller", "148", "PG-13", "dream, ambiguous ending, subconscious, surprise ending, mindbender", "GB", "97", "DOWN 10", "Christopher Nolan", "", "Leonardo DiCaprio, Joseph Gordon-Levitt, Elliot Page", "Leonardo DiCaprio, Joseph Gordon-Levitt, Elliot Page, Tom Hardy", "USD 160,000,000", "USD 62,785,337", "USD 292,587,330", "USD 839,796,627", "Fortress Mountain, Kananaskis Country, Alberta, Canada", "English, Japanese, French", "Dolby Digital, DTS, SDDS", "2.39 : 1", "Color", "160", "220", "Movie", "False", "False", "False"
"Propeller: One-Way Night Coach", "5.7", "1283", "https://www.imdb.com/title/tt41367695/", "https://m.media-amazon.com/images/M/MV5BY2NmNWQyYWQtZjk5MC00NGNjLTgyZTUtMGE4ZDYxZTE2NTg2XkEyXkFqcGc@._V1_.jpg", "Based on Travolta&apos;s 1997 book. Follows young aviation enthusiast Jeff and his mother on a cross-country flight to Hollywood that transforms into a life-changing journey filled with unexpected moments.", "Adventure, Drama, Family", "61", "TV-PG", "twa, nostalgia, travel, airplane, flying", "US", "98", "DOWN 53", "John Travolta", "", "Clark Shotwell, Kelly Eviston-Quinnett, Ellen Travolta", "Clark Shotwell, Kelly Eviston-Quinnett, Ellen Travolta, Jimmy Marino", "", "", "", "", "TWA Hotel, John F. Kennedy International Airport, New York City, New York, USA", "English", "", "2.39 : 1", "Color", "0", "0", "Movie", "False", "False", "False"
"The Alto Knights", "5.9", "21353", "https://www.imdb.com/title/tt21815562/", "https://m.media-amazon.com/images/M/MV5BNTdlY2ZmNmItMjNjMC00YzVkLWEzZDAtYzBiODJkZDRjYWVhXkEyXkFqcGc@._V1_.jpg", "Two of New York City&apos;s most notorious crime bosses vie for control of the city&apos;s streets. Once best friends, petty jealousies and a series of betrayals set them on a deadly collision course.", "Biography, Crime, Drama", "123", "R", "based on real people, 1950s, year 1957, mafia, gangster", "US", "99", "UP 1081", "Barry Levinson", "", "Robert De Niro, Debra Messing, Kathrine Narducci", "Robert De Niro, Debra Messing, Kathrine Narducci, Cosmo Jarvis", "USD 45,000,000", "USD 3,165,349", "USD 6,125,566", "USD 10,225,566", "Cincinnati, Ohio, USA", "English", "Dolby Digital", "2.39 : 1", "Color", "1", "2", "Movie", "False", "False", "False"
"F1", "7.6", "366505", "https://www.imdb.com/title/tt16311594/", "https://m.media-amazon.com/images/M/MV5BNGI0MDI4NjEtOWU3ZS00ODQyLWFhYTgtNGYxM2ZkM2Q2YjE3XkEyXkFqcGc@._V1_.jpg", "A Formula One driver comes out of retirement to mentor and team up with a younger driver.", "Drama, Sport", "155", "PG-13", "motorsport, racing, formula 1, driver, race car driver", "US", "100", "DOWN 20", "Joseph Kosinski", "Joseph Kosinski, Ehren Kruger", "Brad Pitt, Damson Idris, Javier Bardem", "Brad Pitt, Damson Idris, Javier Bardem, Kerry Condon", "USD 200,000,000", "USD 57,001,667", "USD 189,642,436", "USD 634,142,436", "Hungaroring, Budapest, Hungary", "English, Spanish, German, Italian", "Dolby Atmos, IMAX 6-Track, 12-Track Digital Sound, DTS:X, Sonics-DDP, SDDS, Auro 11.1, Dolby Surround 7.1, Dolby Digital", "2.39 : 1", "Color", "32", "129", "Movie", "False", "False", "False"
