"The Ministry of Ungentlemanly Warfare", "6.8", "160229", "https://www.imdb.com/title/tt5177120/", "https://m.media-amazon.com/images/M/MV5BYmIxODc5ZjMtYzZmZS00OTE5LThkZDktNWNmODNiZjFhMDgyXkEyXkFqcGc@._V1_.jpg", "The British military recruits a small group of highly skilled soldiers to strike against German forces behind enemy lines during World War II.", "Action, Comedy, War", "122", "R", "police, cop drama", "IN", "88", "DOWN 52", "Pulkit", "", "Saif Ali Khan, Rasika Dugal, Zakir Hussain", "Saif Ali Khan, Rasika Dugal, Zakir Hussain, Sanjay Mishra", "", "", "", "", "", "Hindi", "Dolby Digital", "2.39:1", "Color", "0", "0", "Movie", "False", "False", "False"
"War Machine", "6.3", "102022", "https://www.imdb.com/title/tt15940132/", "https://m.media-amazon.com/images/M/MV5BMmM1ZTc5ZTYtOTM2My00MjBmLWE5NzktYzkyYzdlYWE3ZDAzXkEyXkFqcGc@._V1_.jpg", "Follow the final recruits of a grueling special ops boot camp who encounter a mysterious deadly force.", "Action, Sci-Fi, Thriller", "106", "R", "william shakespeare character, death of son, one word title, bird, forest", "GB", "82", "DOWN 12", "Chloé Zhao", "Chloé Zhao, Maggie O'Farrell", "Jessie Buckley, Paul Mescal, Zac Wishart", "Jessie Buckley, Paul Mescal, Zac Wishart, James Lintern", "USD 30,000,000", "USD 932,278", "USD 24,208,900", "USD 108,780,022", "Weobley, Herefordshire, England, UK", "English, Latin, French, Greek, Ancient (to 1453)", "Dolby Atmos", "1.78 : 1", "Color", "97", "305", "Movie", "False", "False", "False"
"Inception", "8.8", "2823408", "https://www.imdb.com/title/tt1375666/", "https://m.media-amazon.com/images/M/MV5BMjAxMzY3NjcxNF5BMl5BanBnXkFtZTcwNTI5OTM0Mw@@._V1_.jpg", "A thief who steals corporate secrets through the use of dream-sharing technology is given the inverse task of planting an idea into the mind of a CEO, but his tragic past may doom the project and his team to disaster.", "Adventure, Sci-Fi, Thriller", "148", "PG-13", "police, cop drama", "IN", "88", "DOWN 52", "Pulkit", "", "Saif Ali Khan, Rasika Dugal, Zakir Hussain", "Saif Ali Khan, Rasika Dugal, Zakir Hussain, Sanjay Mishra", "", "", "", "", "", "Hindi", "Dolby Digital", "2.39:1", "Color", "0", "0", "Movie", "False", "False", "False"
"Propeller: One-Way Night Coach", "5.8", "1110", "https://www.imdb.com/title/tt41367695/", "https://m.media-amazon.com/images/M/MV5BY2NmNWQyYWQtZjk5MC00NGNjLTgyZTUtMGE4ZDYxZTE2NTg2XkEyXkFqcGc@._V1_.jpg", "Based on Travolta&apos;s 1997 book. Follows young aviation enthusiast Jeff and his mother on a cross-country flight to Hollywood that transforms into a life-changing journey filled with unexpected moments.", "Adventure, Drama, Family", "61", "TV-PG", "", "SA", "50", "UP 81", "", "Turki Al Alshikh, Mohamed el-Dabah", "Monica Bellucci, Karim Abdel Aziz, Najath Bin Abdurahiman", "Monica Bellucci, Karim Abdel Aziz, Najath Bin Abdurahiman, Sandy Bella", "USD 40,000,000", "", "", "", "Riyadh, Saudi Arabia", "Arabic, English", "", "", "Color", "0", "0", "Movie", "False", "False", "False"
"The Alto Knights", "5.9", "21168", "https://www.imdb.com/title/tt21815562/", "https://m.media-amazon.com/images/M/MV5BNTdlY2ZmNmItMjNjMC00YzVkLWEzZDAtYzBiODJkZDRjYWVhXkEyXkFqcGc@._V1_.jpg", "Two of New York City&apos;s most notorious crime bosses vie for control of the city&apos;s streets. Once best friends, petty jealousies and a series of betrayals set them on a deadly collision course.", "Biography, Crime, Drama", "123", "R", "based on real people, 1950s, year 1957, mafia, gangster", "US", "99", "UP 1081", "Barry Levinson", "", "Robert De Niro, Debra Messing, Kathrine Narducci", "Robert De Niro, Debra Messing, Kathrine Narducci, Cosmo Jarvis", "USD 45,000,000", "USD 3,165,349", "USD 6,125,566", "USD 10,225,566", "Cincinnati, Ohio, USA", "English", "Dolby Digital", "2.39 : 1", "Color", "1", "2", "Movie", "False", "False", "False"
"F1", "7.6", "365122", "https://www.imdb.com/title/tt16311594/", "https://m.media-amazon.com/images/M/MV5BNGI0MDI4NjEtOWU3ZS00ODQyLWFhYTgtNGYxM2ZkM2Q2YjE3XkEyXkFqcGc@._V1_.jpg", "A Formula One driver comes out of retirement to mentor and team up with a younger driver.", "Drama, Sport", "155", "PG-13", "william shakespeare character, death of son, one word title, bird, forest", "GB", "82", "DOWN 12", "Chloé Zhao", "Chloé Zhao, Maggie O'Farrell", "Jessie Buckley, Paul Mescal, Zac Wishart", "Jessie Buckley, Paul Mescal, Zac Wishart, James Lintern", "USD 30,000,000", "USD 932,278", "USD 24,208,900", "USD 108,780,022", "Weobley, Herefordshire, England, UK", "English, Latin, French, Greek, Ancient (to 1453)", "Dolby Atmos", "1.78 : 1", "Color", "97", "305", "Movie", "False", "False", "False"
