"Peddi", "6.2", "4962", "https://www.imdb.com/title/tt23865918/", "https://m.media-amazon.com/images/M/MV5BYjQxNWVmODUtNjY3NC00ODE2LWFhNTItZGY2YzlmYTgzYzJkXkEyXkFqcGc@._V1_.jpg", "In 1980s rural Andhra Pradesh, A spirited villager unites his community through sports to defend their pride against a powerful rival.", "Action, Drama, Romance", "182", "", "period drama, wrestling, underdog sport, coming of age drama", "IN", "63", "UP 310", "Buchi Babu Sana", "", "Ram Charan, Janhvi Kapoor, Shivarajkumar", "Ram Charan, Janhvi Kapoor, Shivarajkumar, Divyendu Sharma", "", "", "", "", "", "Telugu, Tamil", "Dolby Atmos, Dolby Digital, IMAX 5.0, Dolby Surround 7.1, Dolby Surround 5.1", "2.39 : 1", "Color", "0", "0", "Movie", "False", "False", "False"
"Sinners", "7.5", "488611", "https://www.imdb.com/title/tt31193180/", "https://m.media-amazon.com/images/M/MV5BNjIwZWY4ZDEtMmIxZS00NDA4LTg4ZGMtMzUwZTYyNzgxMzk5XkEyXkFqcGc@._V1_.jpg", "Trying to leave their troubled lives behind, twin brothers return to their hometown to start again, only to discover that an even greater evil is waiting to welcome them back.", "Horror", "137", "R", "quest, social media, restaurant, cell phone, married", "DE", "65", "DOWN 13", "Gore Verbinski", "", "Sam Rockwell, Juno Temple, Haley Lu Richardson", "Sam Rockwell, Juno Temple, Haley Lu Richardson, Michael Peña", "USD 20,000,000", "USD 3,644,275", "USD 8,431,443", "USD 9,755,038", "Cape Town, South Africa", "English", "Dolby Atmos", "2.39 : 1", "Color", "0", "1", "Movie", "False", "False", "False"
"Bandar", "7.5", "431", "https://www.imdb.com/title/tt32389930/", "https://m.media-amazon.com/images/M/MV5BOGQ0MmRiY2ItZDFiMy00ZDljLWE5NjItYTkxMzBjYTA2ZGY4XkEyXkFqcGc@._V1_.jpg", "TV star Samar&apos;s life spirals when his ex Gayatri accuses him of rape after he blocks contact with her. Despite his new relationship with Khushi, he faces arrest and encounters a corrupt justice system.", "Crime, Drama, Mystery", "140", "", "cell, criminal, prison, legal, jail", "IN", "65", "UP 4040", "", "Abhishek Banerjee, Sudip Sharma", "Bobby Deol, Gagan Ahuja, Saba Azad", "Bobby Deol, Gagan Ahuja, Saba Azad, Aamir Aziz", "", "", "", "", "Mumbai, Maharashtra, India", "Hindi, Marathi, English", "Dolby Digital, Dolby Atmos", "1.90:1, 2.39:1", "Color", "0", "0", "Movie", "False", "False", "False"
"Kara", "7", "4552", "https://www.imdb.com/title/tt37458112/", "https://m.media-amazon.com/images/M/MV5BNDUzOGQyNTEtZDlhOC00OTRlLThiNzMtMWI5NDliYWVhMTllXkEyXkFqcGc@._V1_.jpg", "In 1991 Ramanathapuram during the Gulf War, Karasamy faces his abandoned past while protecting those who depend on him. An action thriller about a man torn between sin and virtue, fighting to save his family against all odds.", "Action, Crime, Drama", "159", "", "", "US", "33", "UP 79", "Eric Appel", "Nate Bargatze, Dan Lagana", "Nate Bargatze, Mandy Moore, Colin Jost", "Nate Bargatze, Mandy Moore, Colin Jost, Zach Cherry", "", "USD 7,353,073", "USD 7,353,073", "USD 7,353,073", "Atlanta, Georgia, USA", "English", "", "2.39 : 1", "Color", "0", "0", "Movie", "False", "False", "False"
"Swapped", "7.3", "17517", "https://www.imdb.com/title/tt29552248/", "https://m.media-amazon.com/images/M/MV5BNWFlNWM2Y2YtY2VhOC00MWFiLWExNWYtYWViYzJhMDQyMTJiXkEyXkFqcGc@._V1_.jpg", "A tiny woodland creature and a majestic bird suddenly swap bodies, forcing them to team up to survive the wildest adventure of their lives.", "Animation, Adventure, Comedy", "98", "PG", "", "SA", "50", "UP 81", "", "Turki Al Alshikh, Mohamed el-Dabah", "Monica Bellucci, Karim Abdel Aziz, Najath Bin Abdurahiman", "Monica Bellucci, Karim Abdel Aziz, Najath Bin Abdurahiman, Sandy Bella", "USD 40,000,000", "", "", "", "Riyadh, Saudi Arabia", "Arabic, English", "", "", "Color", "0", "0", "Movie", "False", "False", "False"
"Bugonia", "7.4", "197077", "https://www.imdb.com/title/tt12300742/", "https://m.media-amazon.com/images/M/MV5BNzIzNWQxMjEtZmQ3MS00OTk2LWFlZjktZDUyYWRkM2M3NWVlXkEyXkFqcGc@._V1_.jpg", "Two conspiracy-obsessed young men kidnap the high-powered CEO of a major company, convinced that she is an alien intent on destroying planet Earth.", "Comedy, Crime, Sci-Fi", "118", "R", "los angeles california, diamond, heist, male underwear, downtown los angeles", "GB", "60", "DOWN 12", "Bart Layton", "Bart Layton, Don Winslow", "Chris Hemsworth, Mark Ruffalo, Barry Keoghan", "Chris Hemsworth, Mark Ruffalo, Barry Keoghan, Peter Banifaz", "USD 90,000,000", "USD 14,251,834", "USD 36,588,336", "USD 72,900,246", "Echo Park, Los Angeles, California, USA", "English", "DTS:X, Dolby Surround 5.1, Dolby Digital, SDDS, Dolby Atmos", "2.39 : 1", "Color", "0", "0", "Movie", "False", "False", "False"
"Avatar: Fire and Ash", "7.2", "172734", "https://www.imdb.com/title/tt1757678/", "https://m.media-amazon.com/images/M/MV5BZDYxY2I1OGMtN2Y4MS00ZmU1LTgyNDAtODA0MzAyYjI0N2Y2XkEyXkFqcGc@._V1_.jpg", "Jake and Neytiri&apos;s family grapples with grief, encountering a new, aggressive Na&apos;vi tribe, the Ash People, who are led by the fiery Varang, as the conflict on Pandora escalates and a new moral focus emerges.", "Action, Adventure, Fantasy", "197", "PG-13", "quest, social media, restaurant, cell phone, married", "DE", "65", "DOWN 13", "Gore Verbinski", "", "Sam Rockwell, Juno Temple, Haley Lu Richardson", "Sam Rockwell, Juno Temple, Haley Lu Richardson, Michael Peña", "USD 20,000,000", "USD 3,644,275", "USD 8,431,443", "USD 9,755,038", "Cape Town, South Africa", "English", "Dolby Atmos", "2.39 : 1", "Color", "0", "1", "Movie", "False", "False", "False"
"Crime 101", "6.8", "79905", "https://www.imdb.com/title/tt32430579/", "https://m.media-amazon.com/images/M/MV5BZThlN2M4ZTUtYTU3Mi00MDE5LWFhYWUtNjkxMWEwNjUwNDVhXkEyXkFqcGc@._V1_.jpg", "An meticulous jewel thief risks his flawless record against an equally obsessive detective and a volatile rival, while an underestimated insurance broker turns accomplice after decades of professional disrespect.", "Crime, Drama, Thriller", "140", "R", "quest, social media, restaurant, cell phone, married", "DE", "65", "DOWN 13", "Gore Verbinski", "", "Sam Rockwell, Juno Temple, Haley Lu Richardson", "Sam Rockwell, Juno Temple, Haley Lu Richardson, Michael Peña", "USD 20,000,000", "USD 3,644,275", "USD 8,431,443", "USD 9,755,038", "Cape Town, South Africa", "English", "Dolby Atmos", "2.39 : 1", "Color", "0", "1", "Movie", "False", "False", "False"
"México 86", "6.5", "625", "https://www.imdb.com/title/tt37961742/", "https://m.media-amazon.com/images/M/MV5BZGEzYzQ5OTAtYTM2Ny00OTU2LTkwOWUtYmFkYmNiZTg2YTZjXkEyXkFqcGc@._V1_.jpg", "Mexico&apos;s improbable bid to host the 1986 World Cup an audacious, against-all-odds feat made possible only by pure Mexican ingenuity.", "Documentary, Comedy, Drama", "95", "TV-MA", "satire, world cup, satirical, satirical comedy, year in title", "MX", "71", "UP 3577", "Gabriel Ripstein", "Francisco Javier Gonzalez, Daniel Krauze, Luis Reséndiz", "Diego Luna, Karla Souza, Daniel Giménez Cacho", "Diego Luna, Karla Souza, Daniel Giménez Cacho, Memo Villegas", "", "", "", "", "Mexico City, Mexico", "Spanish, English", "Dolby Digital", "2.35 : 1", "Color", "0", "0", "Movie", "False", "False", "False"
"Power Ballad", "7.1", "1380", "https://www.imdb.com/title/tt32267691/", "https://m.media-amazon.com/images/M/MV5BYWI3NGZlNDQtMTAwMC00MGVmLTkyMzgtNjNmYjFhY2VhNDUyXkEyXkFqcGc@._V1_.jpg", "Rick, a washed-up wedding singer, and Danny, a fading boy band star, bond over music and a late-night jam session. When Danny turns Rick&apos;s song into a hit, Rick sets out to reclaim the recognition he believes he deserves.", "Comedy, Drama, Music", "98", "R", "police, cop drama", "IN", "88", "DOWN 52", "Pulkit", "", "Saif Ali Khan, Rasika Dugal, Zakir Hussain", "Saif Ali Khan, Rasika Dugal, Zakir Hussain, Sanjay Mishra", "", "", "", "", "", "Hindi", "Dolby Digital", "2.39:1", "Color", "0", "0", "Movie", "False", "False", "False"
"Good Luck, Have Fun, Don&apos;t Die", "7", "50724", "https://www.imdb.com/title/tt1341338/", "https://m.media-amazon.com/images/M/MV5BOTQ0NzYzM2QtOWYzMC00MGU5LWJmMTQtYTU1ODU0ZjUwYjk0XkEyXkFqcGc@._V1_.jpg", "A &quot;Man From the Future&quot; arrives at a diner in Los Angeles where he must recruit the precise combination of disgruntled patrons to join him on a one-night quest to save the world from the terminal threat of a rogue artificial intel...", "Action, Adventure, Comedy", "134", "R", "dark comedy, sequel, satanic cult, splatter horror, woman bound and gagged", "US", "69", "DOWN 13", "", "Guy Busick, R. Christopher Murphy", "Samara Weaving, Kathryn Newton, Elijah Wood", "Samara Weaving, Kathryn Newton, Elijah Wood, Sarah Michelle Gellar", "USD 17,000,000", "USD 9,075,271", "USD 22,986,054", "USD 39,557,014", "Toronto, Ontario, Canada", "English", "Dolby Atmos, Dolby Digital", "2.39 : 1", "Color", "0", "1", "Movie", "False", "False", "False"
"Huo zhe yan", "7.7", "848", "https://www.imdb.com/title/tt33311069/", "https://m.media-amazon.com/images/M/MV5BODUyZjg2YzctNGE3Yi00YjhhLTkyZTItZTAwZTNhNDA1ODQzXkEyXkFqcGc@._V1_.jpg", "A father fights fiercely against ruthless kidnappers to save his abducted daughter.", "Action, Crime, Thriller", "113", "R", "serial killer, detective, murder investigation, murder, severed head", "US", "99", "DOWN 31", "David Fincher", "", "Morgan Freeman, Brad Pitt, Kevin Spacey", "Morgan Freeman, Brad Pitt, Kevin Spacey, Andrew Kevin Walker", "USD 33,000,000", "USD 13,949,807", "USD 101,871,174", "USD 329,813,591", "Pacific Electric Building, Los Angeles, California, USA", "English", "DTS, Dolby Digital, DTS 70 mm", "2.39 : 1", "Color", "29", "44", "Movie", "False", "False", "False"
"The Passenger", "4.4", "252", "https://www.imdb.com/title/tt32298956/", "https://m.media-amazon.com/images/M/MV5BNzQ4MWI4NGUtYmNkMi00MjBhLThiOTgtMTIyNmNhNWJlZThmXkEyXkFqcGc@._V1_.jpg", "Follows a Somali-American driver who, in a desperate attempt to make ends meet, agrees to transport a mysterious passenger to Chicago. However, he realizes his passenger is not who he seems, trapping him in a terrifying situation.", "Thriller", "93", "", "", "CA", "75", "UP 17162", "Vadim Perelman", "", "Kodi Smit-McPhee, Djimon Hounsou, Leigh-Ann Rose", "Kodi Smit-McPhee, Djimon Hounsou, Leigh-Ann Rose, Carolina Campos", "", "", "", "USD 351,060", "", "", "", "", "Color", "0", "0", "Movie", "False", "False", "False"
"Master of the Universe", "0", "0", "https://www.imdb.com/title/tt41087705/", "https://m.media-amazon.com/images/M/MV5BYjE3ZWM3MjMtMTg3Yi00NTY2LTkwZDItNDdkNGM4OGNiMjU2XkEyXkFqcGc@._V1_.jpg", "A young man must use his untapped powers to fight back against an evil alien and their army, who will stop at nothing to take over Earth and then the universe.", "Action, Fantasy, Sci-Fi", "86", "", "", "US", "76", "UP 50", "Marcel Walz", "", "Matthew Gademske, Bryan Barron, Llana Barron", "Matthew Gademske, Bryan Barron, Llana Barron, Krymis J Fernando", "", "", "", "", "", "English", "", "", "Color", "0", "0", "Movie", "False", "False", "False"
"Normal", "6.3", "13223", "https://www.imdb.com/title/tt31195136/", "https://m.media-amazon.com/images/M/MV5BOGIyZjgwMzMtODEzZS00YmFlLTg3NmItOWMwYzhlZDBjY2U3XkEyXkFqcGc@._V1_.jpg", "Centers on a temporary small-town sheriff who uncovers dark mysteries after a local bank robbery.", "Action, Crime, Thriller", "91", "R", "", "SA", "50", "UP 81", "", "Turki Al Alshikh, Mohamed el-Dabah", "Monica Bellucci, Karim Abdel Aziz, Najath Bin Abdurahiman", "Monica Bellucci, Karim Abdel Aziz, Najath Bin Abdurahiman, Sandy Bella", "USD 40,000,000", "", "", "", "Riyadh, Saudi Arabia", "Arabic, English", "", "", "Color", "0", "0", "Movie", "False", "False", "False"
"Signal One", "5.3", "275", "https://www.imdb.com/title/tt21109170/", "https://m.media-amazon.com/images/M/MV5BZDk1MjU4NWYtZGQ2Ni00MjcxLTliNTEtYzAzZGQzNDNkYjcwXkEyXkFqcGc@._V1_.jpg", "It tells the story of a computer scientist who is recruited by a tech billionaire to work on a project that could change humanity&apos;s place in the universe.", "Mystery, Sci-Fi", "87", "", "", "CA", "78", "UP 754", "Jonathan Sobol", "", "Isabelle Fuhrman, Dennis Quaid, David Thewlis", "Isabelle Fuhrman, Dennis Quaid, David Thewlis, Josh Hutcherson", "", "", "", "", "Cayman Islands", "English", "", "", "Color", "0", "0", "Movie", "False", "False", "False"
"The Running Man", "6.4", "109012", "https://www.imdb.com/title/tt14107334/", "https://m.media-amazon.com/images/M/MV5BMTk5NjU4OTAtNTEyMS00ZjBiLTg0ZjMtOGJiMGJhNjQ3MzYxXkEyXkFqcGc@._V1_.jpg", "A man joins a game show in which contestants, allowed to flee anywhere in the world, are pursued by &quot;hunters&quot; hired to kill them.", "Action, Adventure, Sci-Fi", "133", "R", "quest, social media, restaurant, cell phone, married", "DE", "65", "DOWN 13", "Gore Verbinski", "", "Sam Rockwell, Juno Temple, Haley Lu Richardson", "Sam Rockwell, Juno Temple, Haley Lu Richardson, Michael Peña", "USD 20,000,000", "USD 3,644,275", "USD 8,431,443", "USD 9,755,038", "Cape Town, South Africa", "English", "Dolby Atmos", "2.39 : 1", "Color", "0", "1", "Movie", "False", "False", "False"
"The Dark Knight", "9.1", "3175475", "https://www.imdb.com/title/tt0468569/", "https://m.media-amazon.com/images/M/MV5BMTMxNTMwODM0NF5BMl5BanBnXkFtZTcwODAyMTk2Mw@@._V1_.jpg", "When a menace known as the Joker wreaks havoc and chaos on the people of Gotham, Batman, James Gordon and Harvey Dent must work together to put an end to the madness.", "Crime, Thriller", "152", "PG-13", "u.s. army rangers, team action, army rangers, loss of brother, american soldier", "GB", "76", "DOWN 5", "Patrick Hughes", "Patrick Hughes, James Beaufort", "Alan Ritchson, Stephan James, Blake Richardson", "Alan Ritchson, Stephan James, Blake Richardson, Dennis Quaid", "", "", "", "USD 56,984", "Melbourne, Victoria, Australia", "English", "Dolby Atmos", "2.39 : 1", "Color", "0", "1", "Movie", "False", "False", "False"
"Miss You, Love You", "6.8", "979", "https://www.imdb.com/title/tt30343126/", "https://m.media-amazon.com/images/M/MV5BZjMxYzFlMzAtZmM2MS00MjU4LThjZTUtMzc1M2ZjZmI3YzlkXkEyXkFqcGc@._V1_.jpg", "A widow plans her husband&apos;s funeral. Her estranged son sends his assistant instead of coming himself. The Widow grieves with the assistant.", "Drama", "97", "TV-MA", "los angeles california, diamond, heist, male underwear, downtown los angeles", "GB", "60", "DOWN 12", "Bart Layton", "Bart Layton, Don Winslow", "Chris Hemsworth, Mark Ruffalo, Barry Keoghan", "Chris Hemsworth, Mark Ruffalo, Barry Keoghan, Peter Banifaz", "USD 90,000,000", "USD 14,251,834", "USD 36,588,336", "USD 72,900,246", "Echo Park, Los Angeles, California, USA", "English", "DTS:X, Dolby Surround 5.1, Dolby Digital, SDDS, Dolby Atmos", "2.39 : 1", "Color", "0", "0", "Movie", "False", "False", "False"
"Dead Man&apos;s Wire", "6.5", "9797", "https://www.imdb.com/title/tt15181326/", "https://m.media-amazon.com/images/M/MV5BYzJhZTFjYjQtOGRiYS00ZWZjLWJmYTMtYWY0ZDMzMjM5YmY5XkEyXkFqcGc@._V1_.jpg", "On February 8, 1977, Tony Kiritsis entered the office of Richard Hall, president of the Meridian Mortgage Company, and took him hostage with a sawed-off shotgun wired with a &quot;dead man&apos;s wire&quot; from the trigger to Tony&apos;s own neck.", "Biography, Crime, Drama", "104", "R", "quest, social media, restaurant, cell phone, married", "DE", "65", "DOWN 13", "Gore Verbinski", "", "Sam Rockwell, Juno Temple, Haley Lu Richardson", "Sam Rockwell, Juno Temple, Haley Lu Richardson, Michael Peña", "USD 20,000,000", "USD 3,644,275", "USD 8,431,443", "USD 9,755,038", "Cape Town, South Africa", "English", "Dolby Atmos", "2.39 : 1", "Color", "0", "1", "Movie", "False", "False", "False"
"Primetime", "0", "0", "https://www.imdb.com/title/tt34206385/", "https://m.media-amazon.com/images/M/MV5BZGM5MjUyMmMtY2Y5Zi00NGViLTg3MTctZjAwMzY4MTE2MTBhXkEyXkFqcGc@._V1_.jpg", "Journalist Chris Hansen investigates and exposes a criminal underworld, leading to a major shift in television.", "Action, Crime, Drama", "0", "", "supernatural horror, psychological horror, folk horror, witch horror, novel writer", "IE", "30", "DOWN 5", "Damian McCarthy", "", "Adam Scott, Peter Coonan, David Wilmot", "Adam Scott, Peter Coonan, David Wilmot, Austin Amelio", "", "USD 6,428,305", "USD 16,834,886", "USD 23,585,712", "Skibbereen, Co. Cork, Ireland", "English", "Dolby Atmos", "2.39 : 1", "Color", "0", "0", "Movie", "False", "False", "False"
"Chum", "2.8", "336", "https://www.imdb.com/title/tt41604789/", "https://m.media-amazon.com/images/M/MV5BNGZhZDhhYjItYzI0OC00NWQ5LTk4ZTktOGM1Y2U3Y2I3YmVlXkEyXkFqcGc@._V1_.jpg", "A newlywed couple joins friends on a Mediterranean yacht excursion, only to find themselves caught between a predatory shark and a psychopathic killer in their midst-transforming a sun-drenched escape into a fight for survival.", "Horror, Thriller", "87", "", "", "US", "84", "UP 211", "Jonathan Zuck", "Dick Grunert, Ryan R. Johnson, James Kondelik", "Alice Eve, Eric Michael Cole, Jim Klock", "Alice Eve, Eric Michael Cole, Jim Klock, Elle Haymond", "", "", "", "USD 21,867", "Malta", "English", "", "", "Color", "0", "0", "Movie", "False", "False", "False"
"The Godfather", "9.2", "2229552", "https://www.imdb.com/title/tt0068646/", "https://m.media-amazon.com/images/M/MV5BNGEwYjgwOGQtYjg5ZS00Njc1LTk2ZGEtM2QwZWQ2NjdhZTE5XkEyXkFqcGc@._V1_.jpg", "The aging patriarch of an organized crime dynasty transfers control of his clandestine empire to his reluctant son.", "Crime, Drama", "175", "R", "u.s. army rangers, team action, army rangers, loss of brother, american soldier", "GB", "76", "DOWN 5", "Patrick Hughes", "Patrick Hughes, James Beaufort", "Alan Ritchson, Stephan James, Blake Richardson", "Alan Ritchson, Stephan James, Blake Richardson, Dennis Quaid", "", "", "", "USD 56,984", "Melbourne, Victoria, Australia", "English", "Dolby Atmos", "2.39 : 1", "Color", "0", "1", "Movie", "False", "False", "False"
"Ice Age: Boiling Point", "0", "0", "https://www.imdb.com/title/tt34512981/", "https://m.media-amazon.com/images/M/MV5BMWUyNWFhZDctMTlmNy00ZDFhLWE4NDEtMWQzZGQxM2ZmM2NiXkEyXkFqcGc@._V1_.jpg", "A wild adventure through dinosaurs and lava as Manny, Sid, Diego, Ellie, Scrat and the herd explore uncharted regions of the dangerous Lost World.", "Animation, Adventure, Comedy", "103", "", "animals family, sloth, mammoth, cg animation, sid character", "US", "86", "UP 2608", "John C. Donkin", "", "Denis Leary, John Leguizamo, Simon Pegg", "Denis Leary, John Leguizamo, Simon Pegg, Queen Latifah", "", "", "", "", "", "English, Russian", "", "", "Color", "0", "0", "Movie", "False", "False", "False"
"Scary Movie 2", "5.4", "195682", "https://www.imdb.com/title/tt0257106/", "https://m.media-amazon.com/images/M/MV5BZjZlOTgzNmUtNjZlYS00NWFjLTg4ZDktMWY4NDIxMjVjZjdhXkEyXkFqcGc@._V1_.jpg", "Four teens are tricked by a professor into visiting a haunted house for a school project.", "Comedy, Horror", "83", "R", "sex with a ghost, blow job, hand job, parody comedy, urinating on the floor", "US", "87", "UP 418", "Keenen Ivory Wayans", "Shawn Wayans, Marlon Wayans, Buddy Johnson", "Anna Faris, Marlon Wayans, Antony Acker", "Anna Faris, Marlon Wayans, Antony Acker, Mark Barrett", "USD 45,000,000", "USD 20,503,356", "USD 71,308,997", "USD 141,220,678", "380 South San Rafael Avenue, Pasadena, California, USA", "English", "DTS, Dolby Digital, SDDS", "1.85 : 1", "Color", "3", "5", "Movie", "False", "False", "False"
"The Crash", "6.5", "9136", "https://www.imdb.com/title/tt40792117/", "https://m.media-amazon.com/images/M/MV5BZDg4ZmI0NTUtOGMyMi00ZDgyLTg4ZTQtM2ViYjlmN2E2ODU4XkEyXkFqcGc@._V1_.jpg", "Follows the Mackenzie Shirilla case, a 17-year-old who intentionally crashed her car into a brick wall in Ohio, killing her boyfriend Dominic Russo and his friend Davion Flanagan.", "Documentary, Crime", "92", "TV-MA", "table tennis, new york city, hustler, male nudity, 1950s", "US", "49", "DOWN 11", "Josh Safdie", "Ronald Bronstein, Josh Safdie", "Timothée Chalamet, Gwyneth Paltrow, Odessa A'zion", "Timothée Chalamet, Gwyneth Paltrow, Odessa A'zion, Larry 'Ratso' Sloman", "USD 65,000,000", "USD 863,097", "USD 96,040,064", "USD 191,303,074", "Hancock, New York, USA", "English, Japanese, French, Bosnian", "Dolby Atmos, DTS 70 mm, 12-Track Digital Sound", "2.39 : 1", "Color", "44", "287", "Movie", "False", "False", "False"
"How to Make a Killing", "6.5", "26021", "https://www.imdb.com/title/tt4357198/", "https://m.media-amazon.com/images/M/MV5BOTkwY2JjMWYtOGU4YS00ZTg0LWIzYzUtZDkxNDE5NWNkNWM1XkEyXkFqcGc@._V1_.jpg", "Disowned at birth by his obscenely wealthy family, a blue-collar stop at nothing to reclaim his inheritance, no matter how many relatives stand in his way.", "Comedy, Drama, Thriller", "105", "R", "family relationships, young, caper crime, satire comedy, dark comedy", "GB", "89", "UP 67", "John Patton Ford", "John Patton Ford, Robert Hamer, John Dighton", "Glen Powell, Margaret Qualley, Jessica Henwick", "Glen Powell, Margaret Qualley, Jessica Henwick, Adrian Lukis", "", "USD 3,488,298", "USD 7,851,600", "USD 21,333,967", "Cape Town, South Africa", "English", "", "2.39 : 1", "Color", "0", "1", "Movie", "False", "False", "False"
"The Lord of the Rings: The Fellowship of the Ring", "8.9", "2209829", "https://www.imdb.com/title/tt0120737/", "https://m.media-amazon.com/images/M/MV5BNzIxMDQ2YTctNDY4MC00ZTRhLTk4ODQtMTVlOWY4NTdiYmMwXkEyXkFqcGc@._V1_.jpg", "A meek Hobbit from the Shire and eight companions set out on a journey to destroy the powerful One Ring and save Middle-earth from the Dark Lord Sauron.", "Adventure, Drama, Fantasy", "178", "PG-13", "serial killer, detective, murder investigation, murder, severed head", "US", "99", "DOWN 31", "David Fincher", "", "Morgan Freeman, Brad Pitt, Kevin Spacey", "Morgan Freeman, Brad Pitt, Kevin Spacey, Andrew Kevin Walker", "USD 33,000,000", "USD 13,949,807", "USD 101,871,174", "USD 329,813,591", "Pacific Electric Building, Los Angeles, California, USA", "English", "DTS, Dolby Digital, DTS 70 mm", "2.39 : 1", "Color", "29", "44", "Movie", "False", "False", "False"
"Fast Charlie", "6", "28737", "https://www.imdb.com/title/tt6722400/", "https://m.media-amazon.com/images/M/MV5BODAyNDBlNDItNjQ0Yi00NmJjLWFjYTYtNDczM2EyZTAwMTFjXkEyXkFqcGc@._V1_.jpg", "For twenty years, Charlie Swift has been a fixer and hitman for a mob boss named Stan. After a rival boss puts a hit on Stan and his crew, Charlie is the sole survivor and decides to avenge his friend.", "Action, Crime, Drama", "90", "Not Rated", "friend, gangster crime, caper crime", "GB", "91", "UP 7197", "Phillip Noyce", "Richard Wenk, Victor Gischler", "Pierce Brosnan, Morena Baccarin, James Caan", "Pierce Brosnan, Morena Baccarin, James Caan, Gbenga Akinnagbe", "USD 20,000,000", "", "", "USD 260,233", "New Orleans", "English, Latin", "", "2.35 : 1", "Color", "0", "0", "Movie", "False", "False", "False"
"Superman", "7", "417531", "https://www.imdb.com/title/tt5950044/", "https://m.media-amazon.com/images/M/MV5BOGMwZGJiM2EtMzEwZC00YTYzLWIxNzYtMmJmZWNlZjgxZTMwXkEyXkFqcGc@._V1_.jpg", "Superman must reconcile his alien Kryptonian heritage with his human upbringing as reporter Clark Kent. As the embodiment of truth, justice and the American way he soon finds himself in a world that views these as old-fashioned.", "Action, Adventure, Sci-Fi", "129", "PG-13", "superhero, hero, dc universe, alien, comicbook movie", "US", "92", "UP 19", "James Gunn", "James Gunn, Jerry Siegel, Joe Shuster", "David Corenswet, Rachel Brosnahan, Nicholas Hoult", "David Corenswet, Rachel Brosnahan, Nicholas Hoult, Alan Tudyk", "USD 225,000,000", "USD 125,021,735", "USD 354,223,803", "USD 618,723,803", "Cincinnati, Ohio, USA", "English", "Dolby Atmos, IMAX 6-Track, DTS:X, 12-Track Digital Sound, SDDS, Dolby Surround 7.1, Auro 11.1", "1.85 : 1", "Color", "5", "75", "Movie", "False", "False", "False"
"Ready or Not: Here I Come", "6.5", "41775", "https://www.imdb.com/title/tt33978029/", "https://m.media-amazon.com/images/M/MV5BZTM3N2EyMTEtNDhkMi00ZjNiLWI0MWUtOGViMjExODY3YTJhXkEyXkFqcGc@._V1_.jpg", "After surviving one deadly game, Grace and her sister Faith must now outrun four rival families competing for a powerful throne - winner takes all.", "Comedy, Horror, Thriller", "108", "R", "u.s. army rangers, team action, army rangers, loss of brother, american soldier", "GB", "76", "DOWN 5", "Patrick Hughes", "Patrick Hughes, James Beaufort", "Alan Ritchson, Stephan James, Blake Richardson", "Alan Ritchson, Stephan James, Blake Richardson, Dennis Quaid", "", "", "", "USD 56,984", "Melbourne, Victoria, Australia", "English", "Dolby Atmos", "2.39 : 1", "Color", "0", "1", "Movie", "False", "False", "False"
"28 Years Later: The Bone Temple", "7.2", "106260", "https://www.imdb.com/title/tt32141377/", "https://m.media-amazon.com/images/M/MV5BZGU2M2Y1YTItMWYxNS00NDYxLThhOTYtNjNhOWUzNjA3MTYwXkEyXkFqcGc@._V1_.jpg", "As Spike is inducted into Jimmy Crystal&apos;s gang on the mainland, Dr. Kelson makes a discovery that could alter the world.", "Horror, Sci-Fi, Thriller", "109", "R", "william shakespeare character, death of son, one word title, bird, forest", "GB", "82", "DOWN 12", "Chloé Zhao", "Chloé Zhao, Maggie O'Farrell", "Jessie Buckley, Paul Mescal, Zac Wishart", "Jessie Buckley, Paul Mescal, Zac Wishart, James Lintern", "USD 30,000,000", "USD 932,278", "USD 24,208,900", "USD 108,780,022", "Weobley, Herefordshire, England, UK", "English, Latin, French, Greek, Ancient (to 1453)", "Dolby Atmos", "1.78 : 1", "Color", "97", "305", "Movie", "False", "False", "False"
